Date Logged,Tool Name,Category,Mentions,Description,Source Link,,,,,,,,,,,,,,,,,,,,Phase 5A running — analyzing fallback content (first half)… Thu Apr 02 2026 06:44:20 GMT+0300 (Israel Daylight Time)
02/04/2026,Claude Code,Coding,45,"A sophisticated AI coding agent and operating system for software work, known for its advanced architecture, memory management, ability to build websites and dashboards, and convert files in bulk. It serves as a blueprint for other agent harnesses.",https://x.com/claudeai/status/2038663014098899416,,,,,,,,,,,,,,,,,,,,
02/04/2026,Claude,Coding,42,"An AI assistant with mobile access to workplace tools (Figma, Canva, Amplitude), computer use capabilities (controlling Mac's screen, Auto Mode), useful for finding space on computers, creating Excel dashboards from CSVs, researching meeting participants, analyzing communications, getting detailed company information, and as a business guru for planning, financials, recipes, website setup, SEO, and copy. Also used for editing and refining writing.",https://blog.calif.io/p/mad-bugs-claude-wrote-a-full-freebsd?utm_source=tldrinfosec,,,,,,,,,,,,,,,,,,,,
02/04/2026,ChatGPT,Writing,31,"The most complete chatbot experience, capable of creating skill-style workflows, building and updating spreadsheets from natural language, and integrated into various platforms for lead generation and operating systems.",https://help.openai.com/en/articles/10169521-projects-in-chatgpt,,,,,,,,,,,,,,,,,,,,
02/04/2026,Codex,Coding,31,"An AI coding agent supporting automations and offering plugins to integrate with various work applications like Slack, Figma, Notion, Gmail, and Google Drive for planning, research, and coordination. Also useful for bug hunting.",https://substack.com/redirect/ee692489-9631-4340-bf25-14584dfafd4e?j=eyJ1IjoiN3hvNTZiIn0.YBzePDZcx7ReocSEl7uMk3B2be1RYJqiTBygCGjCYtU,,,,,,,,,,,,,,,,,,,,
02/04/2026,Gemini,Other,28,"A multimodal chatbot that allows users to import chat history and personal context from other AI assistants, aiming for continuity and ease of use. Gemini Live is powered by Gemini 3.1 Flash Live, processing text, images, audio, and video, outperforming others in following complex voice instructions.",https://techcrunch.com/2026/03/26/you-can-now-transfer-your-chats-and-personal-information-from-other-chatbots-directly-into-gemini/,,,,,,,,,,,,,,,,,,,,
02/04/2026,Wispr Flow,Productivity,16,"Turns your voice into clean, formatted text in any app, dictating at 4x the speed of typing, stripping filler words, fixing grammar, and formatting automatically. Works everywhere and on every device.",https://ref.wisprflow.ai/superhumanai,,,,,,,,,,,,,,,,,,,,
02/04/2026,Hyperagent,Other,13,"A self-referential agent system (also known as Darwin Godel Machine Hyperagents) that integrates a task agent and a meta agent to iteratively improve performance on arbitrary tasks, including prompt generation and system modification.",,,,,,,,,,,,,,,,,,,,,
02/04/2026,Cursor,Coding,12,"An AI coder trusted by teams at Stripe, OpenAI, and NVIDIA, that helps build high-quality software faster by allowing users to choose from various frontier models, code with a codebase-aware agent, and run multiple agents in parallel.",https://cursor.com/?utm_source=tldr_paid&utm_medium=paid&utm_campaign=ai,,,,,,,,,,,,,,,,,,,,
02/04/2026,OpenClaw,Coding,12,"An AI agent framework being deployed in robots in China, powering household robots, integrated into humanoids for real-time navigation, and used for natural language control of robotic arms.",https://x.com/jeiting/status/2038380122877710760,,,,,,,,,,,,,,,,,,,,
02/04/2026,Mantis Biotech,Research,12,"A platform that combines different data sources to create synthetic datasets and ""digital twins"" of the human body for simulating body functions, testing procedures, training surgical robots, and predicting medical issues or physical performance.",https://techcrunch.com/2026/03/30/mantis-biotech-is-making-digital-twins-of-humans-to-help-solve-medicines-data-availability-problem/,,,,,,,,,,,,,,,,,,,,
02/04/2026,Veo 3.1 Lite,Image/Video,11,"A lower-cost video generation model from Google DeepMind, available via the Gemini API, supporting text-to-video and image-to-video tasks with various resolutions, formats, and clip durations.",https://blog.google/innovation-and-ai/technology/ai/veo-3-1-lite/?utm_source=tldrai,,,,,,,,,,,,,,,,,,,,
02/04/2026,Accio Work,Productivity,11,"A new agentic system that deploys teams of digital employees to handle complex business tasks 24/7, from e-commerce setup and supplier negotiations to logistics and VAT filing prep, enabling businesses to define outcomes and let agents handle execution.",https://taaft.co/acciowork-s,,,,,,,,,,,,,,,,,,,,
02/04/2026,Claude Mythos,Other,11,"Anthropic's new AI model, a significant step up from the Opus series, performing well in reasoning, coding, and cybersecurity, particularly in finding software flaws and solving complex technical tasks for enterprise use.",https://www.geeky-gadgets.com/claude-mythos-ai-model-overview/,,,,,,,,,,,,,,,,,,,,
02/04/2026,AI agents,Productivity,11,"Autonomous AI tools that can take action across applications, systems, and workflows, increasingly integrated into business operations and used for strengthening cybersecurity, threat detection, incident response, and resilience.",,,,,,,,,,,,,,,,,,,,,
02/04/2026,Cohere Transcribe,Writing,10,"Open-source 2B ASR model supporting 14 languages, optimized for low word error rate, achieved top accuracy on the Hugging Face Open ASR leaderboard.",https://substack.com/redirect/fce5fa17-ce9d-4aaa-ad6f-5ca0b491c639?j=eyJ1IjoiN3hvNTZiIn0.YBzePDZcx7ReocSEl7uMk3B2be1RYJqiTBygCGjCYtU,,,,,,,,,,,,,,,,,,,,
02/04/2026,Lyria 3 Pro,Image/Video,10,"Google's music AI that can create songs up to three minutes long from text prompts, allowing users to request specific song parts and use photos or videos as inspiration.",https://blog.google/innovation-and-ai/technology/ai/lyria-3-pro/,,,,,,,,,,,,,,,,,,,,
02/04/2026,Attie,Other,10,"A new AI assistant that allows users to build custom algorithms and personalized feeds using plain language, with a future goal of enabling AI-assisted app building.",https://www.theverge.com/ai-artificial-intelligence/903190/bluesky-attie-ai-custom-feeds,,,,,,,,,,,,,,,,,,,,
02/04/2026,QA Wolf,Coding,9,"An AI-native service providing high-volume, high-speed automated end-to-end test coverage for web and mobile applications, aiming to reduce QA cycles and enable engineering teams to move faster with guaranteed zero flakes.",https://www.qawolf.com/?utm_source=tldrwebdev&utm_medium=newsletter&utm_campaign=ACQ_All_Demo_Conversions__NewsletterAudience_-_Newsletter_KissBugsGoodbye_20260401-None_Experiment-FALSE&utm_term=headline-KissBugsGoodbyeWithFullyAutomatedEndToEndTestCoverage____Newsletter-PrimaryPlacement_20260401_v1_,,,,,,,,,,,,,,,,,,,,
02/04/2026,Atlassian Rovo,Productivity,9,"Connects company docs, projects, code, decisions, & people into a single, permissions-aware layer to help find answers and do work, such as turning meeting notes into project plans, pulling relevant documents for new projects, and summarizing project updates.",https://srv.buysellads.com/ads/long/x/THULSKIQTTTTTTC2GORNLTTTTTTCKXH726TTTTTT6DXS6BVTTTTTTWLPK266BASGQ7U64J7W27WNWMIU2QYWW5P6CYAE,,,,,,,,,,,,,,,,,,,,
02/04/2026,Google Lyria 3 Pro,Image/Video,9,"AI music tool that creates songs up to three minutes long from text prompts, allows control over song structure, can write lyrics and use visual inspiration, integrated into various Google products.",https://www.theverge.com/ai-artificial-intelligence/900425/google-lyria-3-pro-ai-music,,,,,,,,,,,,,,,,,,,,
02/04/2026,Granola,Productivity,9,"An enterprise AI app with agent support that expanded from a meeting notetaker, offering enhanced productivity features.",https://go.granola.ai/adops-tldr-tech?utm_source=tldrnewsletter,,,,,,,,,,,,,,,,,,,,
02/04/2026,Google Gemini Flash Live,Other,8,"Real-time speech-to-speech voice agent capabilities via streaming API, removes text from the pipeline for reduced delay and intact tone/pacing/intent, supports 90+ languages, continuous stateful sessions, filters background noise, built-in function calling, new voice model geared towards making audio AI more fluid and natural, allows for 2X longer conversations, faster responses with fewer awkward pauses, and tone adjustment depending on context.",https://blog.google/innovation-and-ai/models-and-research/gemini-models/gemini-3-1-flash-live/,,,,,,,,,,,,,,,,,,,,
02/04/2026,Qwen3.5-Omni,Other,8,"Alibaba's full omnimodal large language model with text, image, audio, and video understanding, supporting extensive audio and video processing and multiple languages, surpassing benchmarks in audio reasoning and speech.",https://qwen.ai/blog?id=qwen3.5-omni&utm_source=tldrai,,,,,,,,,,,,,,,,,,,,
02/04/2026,Jotform AI,Productivity,8,"An AI tool that builds forms from text or voice descriptions, incorporating features like conditional logic, autoresponder email, and conversion best practices.",https://taaft.co/jotformai-s/?cid=368198,,,,,,,,,,,,,,,,,,,,
02/04/2026,Attio,Productivity,8,"An AI CRM that connects to other tools, flags churn risk, and turns customer feedback into projects, praised for bridging the gap between customer data and apps.",https://substack.com/redirect/82321804-c824-4d31-a99a-143f8dbc2c4a?j=eyJ1IjoiN3hvNTZiIn0.YBzePDZcxCReocSEl7uMk3B2be1RYJqiTBygCGjCYtU,,,,,,,,,,,,,,,,,,,,
02/04/2026,Siri,Productivity,8,"Apple's personal AI agent, reportedly being rebuilt as a standalone app with deeper on-device intelligence, enhanced conversational skills, AI-powered search, and the ability to control Apple and third-party apps with voice commands.",,,,,,,,,,,,,,,,,,,,,
02/04/2026,Mistral Voxtral TTS,Writing,7,"4B parameter open-weight text-to-speech model for expressive multilingual speech generation, low latency, supports 9 languages, models tone/accent/speaking style, outperforms ElevenLabs v2.5 Flash in human evaluation for voice quality.",https://mistral.ai/news/voxtral-tts,,,,,,,,,,,,,,,,,,,,
02/04/2026,OpenAI Codex plugins,Coding,7,"Connects coding workflows with external tools like Slack, Figma, Notion, and Gmail; runs tasks including planning, research, and coordination before and after writing code; packages workflows and tool access into reusable units called skills.",,,,,,,,,,,,,,,,,,,,,
02/04/2026,Cursor Composer,Coding,7,"Uses real-time reinforcement learning to train on production data and ship updates every five hours, allowing for rapid improvement.",https://cursor.com/blog/real-time-rl-for-composer,,,,,,,,,,,,,,,,,,,,
02/04/2026,Meta TRIBE v2,Research,7,"Open-source foundation model that predicts human brain activity across vision, audio, and language modalities, trained on 700 volunteers, aims to accelerate medical research breakthroughs and better understanding/treating neurological disorders.",https://ai.meta.com/blog/tribe-v2-brain-predictive-foundation-model/,,,,,,,,,,,,,,,,,,,,
02/04/2026,Autodesk AI tools for Maya and 3ds Max,Image/Video,7,"New AI tools for Maya and 3ds Max focusing on practical workflow improvements, including AI-generated horse motion in MotionMaker, Wonder 3D for creating editable 3D objects from text prompts, AI-assisted texturing, and an Autodesk Assistant for simplified software guidance, aiming to eliminate busywork for 3D artists.",https://www.creativebloq.com/3d/autodesks-new-ai-tools-for-maya-and-3ds-max-actually-look-useful-heres-why?utm_source=tldrdesign,,,,,,,,,,,,,,,,,,,,
02/04/2026,Google's Gemini model,Other,7,"Google's multi-modal AI model, used for various tasks including training smaller models, music generation, and video analysis.",,,,,,,,,,,,,,,,,,,,,
02/04/2026,Perplexity Computer,Research,7,"An agent search feature that acts as a personal shopper, finding items in stock, compiling reports, and automating daily market research.",None provided,,,,,,,,,,,,,,,,,,,,
02/04/2026,Stripe Projects,Coding,7,"New tool in Stripe CLI for provisioning real services from the terminal, keeping resources in provider accounts, syncing agent-ready credentials safely, and upgrading to paid tiers, designed for repeatable and deterministic setups for agents.",https://projects.dev/,,,,,,,,,,,,,,,,,,,,
02/04/2026,KiloClaw,Productivity,6,"Runs AI agents in isolated Firecracker micro-VMs with enhanced security features (per-user WireGuard networks, LUKS-encrypted NVMe volumes, secrets encrypted at rest), supports 500+ models, independently assessed.",https://taaft.co/kiloclaw-s/?utm_source=spotlight&utm_medium=taaft&utm_campaign=kiloclaw,,,,,,,,,,,,,,,,,,,,
02/04/2026,Unblocked,Coding,6,"Provides AI agents with organizational context to generate mergeable code without back-and-forth, pulls context from code, PRs, discussions, and planning tools, resolves conflicts, cuts rework and token waste.",https://getunblocked.com/?utm_source=tldrtech&utm_medium=email&utm_campaign=contextengine&utm_content=260330_secondary,,,,,,,,,,,,,,,,,,,,
02/04/2026,Figma AI Image Tools,Image/Video,6,"AI-powered image tools (Expand, Erase, Isolate, Vectorize) integrated into Figma, FigJam, Slides, and Buzz, enabling users to refine visuals across the entire workflow from brainstorming to promotion.",https://www.figma.com/release-notes/?title=ai-image-tools-now-in-figjam-slides-and-buzz&utm_source=tldrdesign,,,,,,,,,,,,,,,,,,,,
02/04/2026,OpenSearch,Research,6,"Delivers vector retrieval, built-in RAG, and agentic workflows for enterprise data. It's open source, Apache 2.0 licensed, and built by a large community.",https://hubs.la/Q047sKPF0,,,,,,,,,,,,,,,,,,,,
02/04/2026,DuploCloud,Productivity,6,"Helps teams find and fix cloud cost leaks, improves cloud modernization efforts, and cuts incremental cloud costs (e.g., Spring Health cut 30-40%).",https://duplocloud.com/aws-modernization-session/?utm_source=contentsyndication&utm_medium=email&utm_campaign=newsletter3&utm_content=tldr,,,,,,,,,,,,,,,,,,,,
02/04/2026,1Password Unified Access,Productivity,6,"A comprehensive solution for unifying access management, designed to reduce endpoint blind spots, credential sprawl, and accountability gaps by providing shadow AI discovery, secure vaulting, and context-aware authorization for humans, agents, and machine identities.",https://1password.com/product/unified-access?utm_medium=paid_newsletter&utm_source=tldr&utm_campaign=2026q2_unified%20access_lp_unified-access_sa&utm_content=devops_newsletter_040126,,,,,,,,,,,,,,,,,,,,
02/04/2026,Littlebird,Productivity,6,"An AI tool that observes screen activity and meetings to build a private memory, designed to understand user work and deliver on the promise of AI that pays attention.",https://littlebird.ai?utm_source=tldr_newsletter&utm_medium=newsletter&utm_campaign=tldrai_quicklink03112026,,,,,,,,,,,,,,,,,,,,
02/04/2026,Critique,Research,6,"A feature within Copilot Researcher that adds a second model (Claude) to review research reports on source quality, completeness, and evidence grounding.",https://x.com/satyanadella/status/2038604619795042716,,,,,,,,,,,,,,,,,,,,
02/04/2026,Oracle AI Database,Coding,6,"Unified memory core for AI agents, combining vector search, relational, JSON, and graph data, allowing agents to reason over live enterprise data without extra vector stores, pipelines, or synchronization jobs.",https://www.oracle.com/database/?source=:ad:nw:op:eng:a_nas::RC_WWMK260212P00002:&SC=:ad:nw:op:eng:a_nas::RC_WWMK260212P00002:&utm_source=tldrdevops,,,,,,,,,,,,,,,,,,,,
02/04/2026,CData Connect AI,Other,6,"An AI solution that achieved 98.5% accuracy in benchmarking MCP server approaches, excelling in translating natural language to REST calls for CRM, ERP, project management, and cloud data warehouses.",https://www.cdata.com/lp/ai-accuracy-whitepaper/?utm_source=Neuron&utm_medium=newsletter_0329&utm_campaign=26Q1_Accuracy_WP,,,,,,,,,,,,,,,,,,,,
02/04/2026,TurboQuant,Other,6,"A compression algorithm that reduces LLM cache memory by 6X to deliver 8X faster computations with zero accuracy loss, potentially reducing cost and compute needs for LLMs.",https://research.google/blog/turboquant-redefining-ai-efficiency-with-extreme-compression/,,,,,,,,,,,,,,,,,,,,
02/04/2026,Prospecting Agent,Productivity,6,"An AI agent within HubSpot's Sales Hub that automates company and prospect research, prioritizes leads, and drafts high-quality outreach, saving sales teams significant time.",,,,,,,,,,,,,,,,,,,,,
02/04/2026,Plus One by Every,Productivity,6,"A hosted OpenClaw solution that integrates into Slack, pre-loaded with skills and workflows, and connected to other Every tools for email, writing, and document management.",https://substack.com/redirect/ce06a0e1-dcc7-4645-a516-1dc746d06d95?j=eyJ1IjoiN3hvNTZiIn0.YBzePDZcx7ReocSEl7uMk3B2be1RYJqiTBygCGjCYtU,,,,,,,,,,,,,,,,,,,,
02/04/2026,Rime's AI voice models,Writing,5,"AI voice models that capture tone, rhythm, and natural variability of human speech, designed by linguists for actual conversations in multiple languages, work on-prem and in the cloud, low latency, outperforms Google and ElevenLabs.",https://rime.ai/?utm_source=email&utm_medium=sponsorship&utm_campaign=tldr-march&utm_term=comparison,,,,,,,,,,,,,,,,,,,,
02/04/2026,Checkmarx Agentic AI Buyer's Guide,Coding,5,"Provides guidance on evaluating agentic security solutions, identifies essential capabilities, and offers evaluation scenarios; Checkmarx Developer Assists integrates agentic security into the IDE.",https://checkmarx.com/the-agentic-ai-buyers-guide/?utm_source=tldr_email&utm_medium=email&utm_campaign=tldr_newsletter,,,,,,,,,,,,,,,,,,,,
02/04/2026,Base44,Coding,5,"An AI tool that builds the UI, database, auth, and hosting for any app described in plain English, allowing users to iterate fast and publish with built-in hosting without coding.",https://taaft.co/base44160326-s,,,,,,,,,,,,,,,,,,,,
02/04/2026,Plus One,Productivity,5,"A hosted personal AI agent tool by Every, built using OpenClaw, that offers memory, personality, and pre-loaded workflows for daily briefings, bug reports, and more.",https://every.to/plus-one,,,,,,,,,,,,,,,,,,,,
02/04/2026,Marksnip,Coding,5,"A Chrome extension to quickly grab the “meat” of documentation pages, Tweets, articles, or government sites as markdown files to provide context for AI coding agents.",https://chromewebstore.google.com/detail/marksnip-markdown-web-cli/kcbaglhfgbkjdnpeokaamjjkddempipm,,,,,,,,,,,,,,,,,,,,
02/04/2026,Copilot Cowork,Productivity,5,"Microsoft's in-house version of Claude Cowork, designed to handle multi-step workflows by drafting and launching plans.",https://www.microsoft.com/en-us/microsoft-365/blog/2026/03/30/copilot-cowork-now-available-in-frontier/,,,,,,,,,,,,,,,,,,,,
02/04/2026,Perplexity,Research,5,"An AI platform recommended for understanding news coverage from different perspectives, surfacing sources, and suggesting related questions for evidence-based research.",None provided,,,,,,,,,,,,,,,,,,,,
02/04/2026,You.com,Research,5,Provides guides and resources for mastering metadata management to streamline AI projects and maximize ROI.,https://you.com/resources/what-is-ai-grounding-downloadable?utm_campaign=33212815-Superhuman_Q1&utm_source=external-newsletter&utm_medium=email&utm_term=superhuman_primary_3.31&utm_content=superhuman_primary_3.31,,,,,,,,,,,,,,,,,,,,
02/04/2026,Spinach AI,Productivity,5,"The most accurate AI notetaker in 100+ languages that records, transcribes & summarizes meetings, then feeds context to Claude, ChatGPT or Cursor, syncs action items to project management tools, and updates CRMs.",https://www.spinach.ai/?utm_source=superhuman&utm_medium=newsletter&utm_campaign=primary-ad-032626,,,,,,,,,,,,,,,,,,,,
02/04/2026,TRIBE v2,Research,5,"An open-source AI model that simulates neural activity across vision, hearing, and language, with synthetic predictions outperforming real fMRI recordings, significantly compressing brain research time.",None provided,,,,,,,,,,,,,,,,,,,,
02/04/2026,Tinker,Image/Video,5,"A new free mobile app by Shopify that provides tools to create images and videos for purposes like social media posts, product staging, and virtual try-ons.",https://substack.com/redirect/608b4637-2793-4410-ab85-aaade0ee93db?j=eyJ1IjoiN3hvNTZiIn0.YBzePDZcx7ReocSEl7uMk3B2be1RYJqiTBygCGjCYtU,,,,,,,,,,,,,,,,,,,,
02/04/2026,Ramp CLI,Productivity,5,"A CLI tool that provides AI agents with over 50 tools for managing company finances, including cards, bills, expenses, and travel approvals.",https://agents.ramp.com/,,,,,,,,,,,,,,,,,,,,
02/04/2026,TAAFT Prompt Pack,Productivity,4,"A collection of 99 multi-paragraph prompt frameworks, tested and refined by the TAAFT team, designed to get structured results in seconds across 11 categories for various AI models.",https://theresanaiforthat.com/ebook/?ref=email,,,,,,,,,,,,,,,,,,,,
02/04/2026,Autify Aximo,Coding,4,"An autonomous AI testing agent that navigates applications like a real user, allowing natural language descriptions for tests across web, mobile, and desktop, adapting to UI changes and reporting results with zero maintenance.",https://taaft.co/aximo-s/?utm_source=othercampaigns&utm_medium=theresanaiforthat&utm_campaign=trialpromo&utm_content=spotlightad,,,,,,,,,,,,,,,,,,,,
02/04/2026,WorkOS,Coding,4,"An API that connects products to user applications like Slack, GitHub, and Salesforce, enabling context pulling, data cross-referencing, and powering AI agents across services with managed credentials.",,,,,,,,,,,,,,,,,,,,,
02/04/2026,MiniMax,Other,4,"An agentic model that participates in its own training, handles complex multi-step tasks, and offers an Office Skills library for generating deliverable files. It also provides a multimodal subscription.",https://www.minimax.io/?utm_source=tldr&utm_medium=newsletter&utm_campaign=primary_2026_04_01,,,,,,,,,,,,,,,,,,,,
02/04/2026,Mindstream,Productivity,4,"A newsletter that provides headlines, context, and important AI news in a concise format.",,,,,,,,,,,,,,,,,,,,,
02/04/2026,Codex plugin for Claude Code,Coding,4,An open-source plugin that integrates OpenAI's Codex into Claude Code workflows for reviews and second passes by a different agent.,https://links.tldrnewsletter.com/Lnu60F,,,,,,,,,,,,,,,,,,,,
02/04/2026,Base44 Superagents,Productivity,4,"AI superagents that run 24/7, automate tasks like inbox management and lead follow-up, and integrate with various platforms like Gmail, Google Calendar, Slack, WhatsApp, and Telegram.",https://taaft.co/base44superagents-s,,,,,,,,,,,,,,,,,,,,
02/04/2026,USV internal AI agents,Productivity,4,"Internal AI agents that ingest meeting transcripts, emails, and calendars to create a continuously updated internal knowledge base/custom CRM, improving context aggregation across workflows.",https://links.tldrnewsletter.com/3UYIFT,,,,,,,,,,,,,,,,,,,,
02/04/2026,CapCut Dreamina Seedance 2.0,Image/Video,4,"New video and audio generation model with built-in safety safeguards, initially for paid users in select global markets.",https://www.capcut.com/newsroom/dreamina-seedance-2?utm_source=tldrai,,,,,,,,,,,,,,,,,,,,
02/04/2026,Cloudflare Dynamic Worker Loader,Coding,4,"Creates lightweight JavaScript sandboxes that spin up in milliseconds and use just a few megabytes of memory, making them 100x faster and 10x-100x more memory efficient than containers for executing AI-generated code, allowing agents to write and run code on-the-fly without global concurrency limits.",https://blog.cloudflare.com/dynamic-workers/?utm_source=tldrdevops,,,,,,,,,,,,,,,,,,,,
02/04/2026,Teleport,Coding,4,"A tool that issues workload identities, short-lived credentials, and provides full audit visibility for AI agents in production, designed to accelerate AI innovation by managing agent access and accountability.",https://fandf.co/3NQ6raP,,,,,,,,,,,,,,,,,,,,
02/04/2026,Airia,Productivity,4,"An enterprise AI platform that unifies deployment, orchestration, security, and governance in one powerful system, allowing organizations to scale AI confidently, securely, and on their own terms.",https://airia.com/request-demo/?utm_source=Rundown%2C+Newsletter+&utm_medium=email&utm_campaign=Newsletter%2C+Run+downMarch+,,,,,,,,,,,,,,,,,,,,
02/04/2026,Claude Cowork,Coding,4,"A tool that runs commands in a sandbox, isolating potentially malicious code from the user's computer.",https://substack.com/redirect/96c8b4fb-875b-4301-8359-51c93992d707?j=eyJ1IjoiN3hvNTZiIn0.YBzePDZcx7ReocSEl7uMk3B2be1RYJqiTBygCGjCYtU,,,,,,,,,,,,,,,,,,,,
02/04/2026,Omma,Image/Video,4,"AI tool to create 3D apps and websites from prompts, orchestrates multiple AI agents to generate code, images, 3D models, and process data simultaneously, turning hours of work into seconds.",https://omma.build/,,,,,,,,,,,,,,,,,,,,
02/04/2026,Google Stitch,Image/Video,4,"An AI tool for 'vibe design' that allows users to create and refine designs, such as landing pages, using voice prompts, with the AI updating the canvas in real time.",https://stitch.withgoogle.com/,,,,,,,,,,,,,,,,,,,,
02/04/2026,WorkOS FGA,Productivity,4,"Provides an authorization layer for AI agents, defining their blast radius with resource-level permissions to ensure enterprise safety and trust.",https://workos.com/blog/agents-need-authorization-not-just-authentication?utm_source=neuron&utm_medium=newsletter&utm_campaign=q22026,,,,,,,,,,,,,,,,,,,,
02/04/2026,Helena,Productivity,4,"An autonomous AI agent that streamlines marketing by conducting deep research, generating assets, and posting them online.",https://www.enrichlabs.ai/,,,,,,,,,,,,,,,,,,,,
02/04/2026,Framer,Coding,4,"A no-code platform for building professional websites quickly, with AI growth tools, CMS, analytics, and AI localization.",https://srv.buysellads.com/ads/long/x/TFFYMJDQTTTTTT6UHSCNLTTTTTT5AZOG26TTTTTTA32KVBVTTTTTTMD3CR26ANDNCMB6EYBFCY7NEWBCCKS6W7P6CMME?cid=363701,,,,,,,,,,,,,,,,,,,,
