Date Logged,Tool Name,Category,Mentions,Description,Source Link,,,,,,,,,,,,,,,,,,,,Phase 5A running — analyzing fallback content (first half)… Thu Apr 02 2026 06:44:20 GMT+0300 (Israel Daylight Time)
02/04/2026,Suno,Image/Video,4,"An AI music generator with upgraded personalization, voice cloning, custom model tuning, and personalized style learning, allowing users to become musicians.",,,,,,,,,,,,,,,,,,,,,
02/04/2026,Slackbot,Productivity,4,"An updated agent in Slack by Salesforce with 30 new capabilities, enabling it to execute workflows across apps, desktop, and enterprise data in chat.",https://slack.com/features/slackbot/demo-slackbot?d=701ed000012lq2tAAA&nc=701ed000012lonAAAQ&utm_source=theneuronai&utm_medium=tp_email&utm_campaign=amer_us_slack-invoice_&utm_content=allsegments_all-strategic-theneuron-tertiary-mar31_701ed000012lq2tAAA_english_demo-slackbot,,,,,,,,,,,,,,,,,,,,
02/04/2026,PokeeClaw,Productivity,4,"An enterprise-secure AI agent platform with zero setup, numerous app integrations, and isolated sandboxes, endorsed as a production-ready OpenClaw alternative.",https://pokee.ai/,,,,,,,,,,,,,,,,,,,,
02/04/2026,Hugging Face,Research,4,"A platform that serves as the ""GitHub of modern AI,"" offering a gigantic open-source catalog, one-click deployment tools, and pay-as-you-go compute.",https://huggingface.co/,,,,,,,,,,,,,,,,,,,,
02/04/2026,Scroll.ai,Productivity,3,"An AI platform offering knowledge agents that provide accurate and fast AI experiences by turning any knowledge base into a world-class AI experience, used by thousands of teams for employee enablement, customer education, and business insights.",https://www.scroll.ai/?utm_source=tldrai&utm_medium=newsletter&utm_campaign=tldrai_apr2026,,,,,,,,,,,,,,,,,,,,
02/04/2026,Gemini API Docs MCP and Agent Skills,Coding,3,"Tools introduced by Google to improve coding agents' performance by providing access to up-to-date Gemini APIs and best practices, leading to a high pass rate on Google's eval set.",https://blog.google/innovation-and-ai/technology/developers-tools/gemini-api-docsmcp-agent-skills/?utm_source=tldrai,,,,,,,,,,,,,,,,,,,,
02/04/2026,mirrord,Coding,3,"Connects AI coding agents to real API responses, database state, and queue payloads for testing against actual staging environments.",https://metalbear.com/mirrord/ai-agents/?utm_source=tldrdevops&utm_medium=tldrnewsletter&utm_campaign=ql-20260330&utm_content=std,,,,,,,,,,,,,,,,,,,,
02/04/2026,Bland AI / Norm,Other,3,"A voice AI assistant that allows users to create fully functional phone agents from a single prompt, generating agent logic, conditions, and integrations.",https://www.bland.ai/?utm_source=airundown&utm_medium=newsletter&utm_campaign=April1&utm_id=airundown,,,,,,,,,,,,,,,,,,,,
02/04/2026,Bonsai,Other,3,"A tiny open-source AI model (PrismML's 1-bit Bonsai) that is highly efficient, fitting into 1.15 GB and running on an iPhone at 40 tokens/sec.",https://prismml.com/news/bonsai-8b,,,,,,,,,,,,,,,,,,,,
02/04/2026,Onyx,Other,3,"A new open-source, self-hostable AI chat platform with agents, RAG, web search, deep research, MCP support, and connectors to 40+ knowledge sources.",https://github.com/onyx-dot-app/onyx?utm_source=tldrdevops,,,,,,,,,,,,,,,,,,,,
02/04/2026,Fivetran,Productivity,3,"Delivers analytics-ready data from over 700 data sources in hours, handling schema changes, API updates, and retries.",https://go.fivetran.com/signups/smb?utm_source=tldrdata,,,,,,,,,,,,,,,,,,,,
02/04/2026,Cato AI Security,Productivity,3,"AI security solution to manage risks within AI interactions, discover Shadow AI, apply prompt/response guardrails, and protect AI applications/agents at runtime.",https://www.catonetworks.com/resources/secure-your-ai-transformation/?utm_source=tldr-ai&utm_medium=newsletter&utm_campaign=ai-security&utm_content=20260327,,,,,,,,,,,,,,,,,,,,
02/04/2026,Fin (by Intercom),Productivity,3,"High-performing, fast, and cheap customer service AI agent that consistently outperforms competitors, resolves millions of customer issues weekly, and has grown to nearly $100 million in recurring revenue.",,,,,,,,,,,,,,,,,,,,,
02/04/2026,Nebius Token Factory,Productivity,3,"Platform for teams shipping AI at scale, runs open-source LLMs in production, allows capturing live traffic, fine-tuning, optimizing, and deploying checkpoints to dedicated GPU endpoints with stable latency, predictable cost, and clear data residency.",https://tokenfactory.nebius.com/?utm_source=superhuman&utm_medium=newsletter&utm_campaign=tokenfactory,,,,,,,,,,,,,,,,,,,,
02/04/2026,Reco AI (gnata),Coding,3,"AI-powered rewrite of JSONata into 'gnata' (pure-Go implementation), achieving 1,000x speedup and significant cost savings for processing billions of events.",https://www.reco.ai/blog/we-rewrote-jsonata-with-ai?utm_source=tldrdev,,,,,,,,,,,,,,,,,,,,
02/04/2026,EDB's blueprinting tools,Productivity,3,"Free interactive tools that instantly generate custom database architecture plans tailored to project requirements, offering unlimited testing and no-friction access.",https://www.enterprisedb.com/?utm_source=em&utm_medium=pa&utm_campaign=em_ww_tldr_newsletter-tai-20260323,,,,,,,,,,,,,,,,,,,,
02/04/2026,Holo 3,Other,3,"An open-weight, state-of-the-art computer-use agent that scored highly on benchmarks with fewer parameters.",https://hcompany.ai/holo3,,,,,,,,,,,,,,,,,,,,
02/04/2026,Hermes Agent,Coding,3,"A self-improving AI agent with persistent memory, multiple terminal backends, and messaging platform gateways, updated with video generation and multi-instance agent workflows.",https://github.com/NousResearch/hermes-agent,,,,,,,,,,,,,,,,,,,,
02/04/2026,Composer 2,Coding,3,"A model that uses a two-stage training approach to improve long-horizon coding, achieving strong results on software engineering benchmarks.",https://arxiv.org/abs/2603.24477,,,,,,,,,,,,,,,,,,,,
02/04/2026,Lovable,Coding,3,"Offers a clean end-to-end ""vibe coding"" experience, covering ideation through polish with Agent Mode, Chat Mode, and Visual Edits, including security and publishing features.",https://techcrunch.com/2026/03/23/vibe-coding-startup-lovable-is-on-the-hunt-for-acquisitions/?utm_source=tldrdesign,,,,,,,,,,,,,,,,,,,,
02/04/2026,Voxtral TTS,Image/Video,3,Mistral's lightweight voice AI that clones any speaker from a 3-second clip and generates natural-sounding speech across 9 languages.,https://mistral.ai/news/voxtral-tts,,,,,,,,,,,,,,,,,,,,
02/04/2026,Midjourney,Image/Video,3,An AI tool for creating killer thumbnails using specific techniques.,None provided,,,,,,,,,,,,,,,,,,,,
02/04/2026,Figma,Image/Video,3,"An end-to-end product-building OS that, with AI add-ons, extends beyond design into working prototypes and live sites.",https://www.figma.com/release-notes/?title=design-with-agents-on-the-figma-canvas-now-in-beta&utm_source=tldrdesign,,,,,,,,,,,,,,,,,,,,
02/04/2026,Gemini 3.1 Flash Live,Other,3,"A new voice model geared towards making audio AI more fluid and natural, powering Gemini Live for longer conversations, faster responses, and tone adjustment.",None provided,,,,,,,,,,,,,,,,,,,,
02/04/2026,Manus,Productivity,3,A consumer-facing computer-use agent with a Task Replay feature for transparency and a Wide Research mode powerful for high-volume comparisons and source synthesis.,None provided,,,,,,,,,,,,,,,,,,,,
02/04/2026,Pinecone Assistant,Research,3,"An end-to-end knowledge service that simplifies AI retrieval by handling chunking, embedding, search, and reranking, allowing users to upload data and query documents instantly.",,,,,,,,,,,,,,,,,,,,,
02/04/2026,SerpApi,Research,3,"A web data API that turns search results into structured, ready-to-use data with built-in scale and block resilience, powering AI apps, product research, price tracking, and SEO insights.",,,,,,,,,,,,,,,,,,,,,
02/04/2026,Agentforce,Productivity,3,"Integrates powerful AI agents directly into Slack, allowing users to interact with them to pull Salesforce insights, update records, and create canvases, enhancing team productivity.",,,,,,,,,,,,,,,,,,,,,
02/04/2026,Higgsfield,Image/Video,3,"An image and video generator used to create custom, branded reaction GIFs for platforms like Slack.",,,,,,,,,,,,,,,,,,,,,
02/04/2026,Tely AI,Productivity,3,"Helps businesses get recommended by AI platforms like ChatGPT, Google, Perplexity, and Claude, generating leads on autopilot, especially useful for niche industries.",,,,,,,,,,,,,,,,,,,,,
02/04/2026,PrismML's 1-bit Bonsai,Other,3,"An 8B-parameter model that is 14x smaller than its peers, runs efficiently on an iPhone, and offers competitive performance with full-precision models, demonstrating concentrated intelligence.",,,,,,,,,,,,,,,,,,,,,
02/04/2026,Softr,Coding,3,"An AI-native no-code platform that enables anyone to build production-ready business applications with complex components like databases, permissions, or user interface, running on Softr’s infrastructure.",https://www.softr.io/,,,,,,,,,,,,,,,,,,,,
02/04/2026,Ollama,Other,3,"A tool for running private AI models locally with a single command in the terminal, working offline and keeping data on the machine.",https://ollama.com/,,,,,,,,,,,,,,,,,,,,
02/04/2026,Moondream Photon,Image/Video,3,"Delivers real-time vision AI with high performance (46ms end-to-end, 60+ fps on a single GPU), optimized for production and free to try.",https://moondream.ai/blog/photon-real-time-vision-ai-is-finally-here,,,,,,,,,,,,,,,,,,,,
02/04/2026,Suno v5.5,Image/Video,3,"An AI tool that clones singing voices and trains custom models to learn musical styles, generating songs. It has a free tier and paid subscriptions.",https://suno.com/,,,,,,,,,,,,,,,,,,,,
02/04/2026,Cog,Coding,3,"Plain-text cognitive architecture for Claude Code that allows it to build and maintain its own persistent memory using familiar Unix tools like `grep` and `git diff`, guiding Claude in structuring a three-tier memory system.",https://github.com/marciopuga/cog?utm_source=tldrdev,,,,,,,,,,,,,,,,,,,,
02/04/2026,CanIRun.ai,Other,3,A free online tool that scans hardware in the browser and tells users exactly which AI models their machine can run locally.,https://CanIRun.ai,,,,,,,,,,,,,,,,,,,,
02/04/2026,Ensu,Other,3,"A privacy-first tool that runs a private LLM on the user's device, growing over time and keeping all data local.",https://ente.com/blog/ensu/?utm_source=tldrdev,,,,,,,,,,,,,,,,,,,,
02/04/2026,Projects.dev by Stripe,Coding,3,"A tool by Stripe that allows agents to use third-party services from the CLI, simplifying account creation, API key management, and billing setup for partnered apps.",https://substack.com/redirect/cb019a46-94ad-4866-b2e7-3a78e51a0b9b?j=eyJ1IjoiN3hvNTZiIn0.YBzePDZcxCReocSEl7uMk3B2be1RYJqiTBygCGjCYtU,,,,,,,,,,,,,,,,,,,,
02/04/2026,Qwen 3.5-Omni,Other,3,"A native omnimodal AI model capable of handling text, image, audio, and video with real-time streaming.",https://qwen.ai/blog?id=qwen3.5-omni,,,,,,,,,,,,,,,,,,,,
02/04/2026,Cowork,Productivity,3,"A tool (associated with Claude) that supports automations and scheduled tasks, and enables Claude Code's computer use.",,,,,,,,,,,,,,,,,,,,,
02/04/2026,Spiral (Every),Writing,3,An AI writing partner that builds style guides from user's posts and writing samples.,,,,,,,,,,,,,,,,,,,,,
02/04/2026,Sparkle (Every),Productivity,3,An AI tool for file organization and duplicate cleanup on Mac.,,,,,,,,,,,,,,,,,,,,,
02/04/2026,Cora (Every),Productivity,3,An AI email assistant available on iOS.,,,,,,,,,,,,,,,,,,,,,
02/04/2026,Monologue (Every),Writing,3,A voice dictation tool that transcribes speech in a natural writing style.,,,,,,,,,,,,,,,,,,,,,
02/04/2026,Proof (Every),Writing,3,An agent-first collaborative document editor that is free and open source.,,,,,,,,,,,,,,,,,,,,,
02/04/2026,Tesla’s Full Self-Driving,Other,3,"Tesla's advanced driver-assistance system that handles complex driving scenarios with high capability, earning the user's trust for its constant awareness and ability to navigate variable real-time environments.",,,,,,,,,,,,,,,,,,,,,
02/04/2026,AI delegates,Productivity,3,"Automated AI systems designed to monitor politics, suggest votes, and potentially serve as policymakers on behalf of citizens.",,,,,,,,,,,,,,,,,,,,,
02/04/2026,Gmail AI Inbox,Productivity,2,"A Gemini-powered view in Gmail that surfaces suggested to-dos from priority emails, groups less urgent updates, and identifies VIPs based on conversation patterns.",https://support.google.com/mail/answer/16845247,,,,,,,,,,,,,,,,,,,,
02/04/2026,Slack AI Features,Productivity,2,"Slack's new AI features, including Slackbot, which runs reusable AI skills, transcribes meetings, drafts follow-ups, and monitors desktop activity to make suggestions.",https://www.salesforce.com/slack/slackbot/agent-orchestration/,,,,,,,,,,,,,,,,,,,,
02/04/2026,Rovo,Productivity,2,"Connects a company’s documents, projects, code, decisions, and people into a single, permissions-aware layer for quick access.",https://taaft.co/rovo300326-s,,,,,,,,,,,,,,,,,,,,
02/04/2026,LFM2.5-350M,Coding,2,"An open-weight 350M model from Liquid AI, optimized for fast edge inference and tool use.",,,,,,,,,,,,,,,,,,,,,
02/04/2026,AI Search Handbook,Research,2,"A handbook created with bycloud, offering guidance on how sites appear on AI search engines, content optimization for marketers, and LLM crawler optimization for developers.",https://offers.hubspot.com/how-llms-read-websites?utm_medium=email-media-newsletter&utm_source=mindstream&utm_campaign=owned&utm_term=2026-04-01&utm_content=native-ads,,,,,,,,,,,,,,,,,,,,
02/04/2026,PrismML,Other,2,A technology developed by Caltech researchers that uses extreme compression (1-bit technology) to enable high-fidelity AI models to run locally on edge devices with radically compressed size and uncompromised performance.,https://links.tldrnewsletter.com/Jyr9p5,,,,,,,,,,,,,,,,,,,,
02/04/2026,Adobe Firefly Custom Models,Image/Video,2,"Custom AI models from Adobe Firefly, allowing creatives to train AI on their own work to generate consistent, on-brand visuals, enabling faster workflows and scalable content production while preserving creative identity.",https://www.creativebloq.com/design/graphic-design-software/adobe-fireflys-custom-ai-models-preserve-the-unique-soul-of-your-work?utm_source=tldrdesign,,,,,,,,,,,,,,,,,,,,
02/04/2026,FigPrompt,Coding,2,"An AI tool that writes, packages, and delivers ready-to-install plugins for designers based on their described behavior.",https://figprompt.com?utm_source=tldrdesign,,,,,,,,,,,,,,,,,,,,
02/04/2026,PagerDuty SRE Agent,Productivity,2,"An AI-powered virtual responder that automates incident triage, summarizes context, and recommends or executes actions to reduce alert fatigue and speed resolution, also supporting continuous improvement by analyzing incidents.",https://www.pagerduty.com/blog/ai/meet-your-virtual-responder-pagerdutys-sre-agent-for-ai-driven-reliability/?utm_source=tldrdevops,,,,,,,,,,,,,,,,,,,,
02/04/2026,Cloudflare Client-Side Security Advanced,Other,2,"Cloudflare's product for client-side security, using a two-stage AI detection approach (Graph Neural Network with Large Language Model) to analyze scripts, reduce false positives, and detect novel attacks.",https://blog.cloudflare.com/client-side-security-open-to-everyone/?utm_source=tldrdevops,,,,,,,,,,,,,,,,,,,,
02/04/2026,OpenBB,Research,2,"An open-source toolkit (Open Data Platform) that allows data engineers to integrate proprietary, licensed, and public data sources into AI copilots and research dashboards with a 'connect once, consume everywhere' architecture.",https://github.com/OpenBB-finance/OpenBB?utm_source=tldrdevops,,,,,,,,,,,,,,,,,,,,
02/04/2026,OpenCode,Coding,2,An autonomous agent used for generating API integrations efficiently.,https://nango.dev/blog/learned-building-200-api-integrations-with-opencode/?utm_source=tldrdev,,,,,,,,,,,,,,,,,,,,
02/04/2026,Microsoft 365 Copilot Researcher,Research,2,An AI assistant that has introduced Critique and Council modes to enhance research capabilities.,https://www.testingcatalog.com/microsoft-365-copilot-gets-critique-and-council-modes/?utm_source=tldrai,,,,,,,,,,,,,,,,,,,,
02/04/2026,Council,Research,2,A mode within Microsoft 365 Copilot that allows parallel report generation using multiple AI models for comparison and insight aggregation.,,,,,,,,,,,,,,,,,,,,,
02/04/2026,Miro,Productivity,2,"An AI-driven prototyping tool that helps turn rough ideas into testable concepts, enabling non-designers to create and iterate.",https://miro.com/events/webinar/prototyping-earlier-to-build/?utm_campaign=glb-27q1-glb-wb-hi-c3_o2-prototyping_earlier_webinar&utm_source=tldr&utm_medium=newsletter&utm_content=sponsorship&src=-tldr_glb&utm_term=tldr-ai-secondary,,,,,,,,,,,,,,,,,,,,
02/04/2026,TimesFM,Research,2,"A pretrained time-series foundation model for time-series forecasting, performing well across various forecasting parameters.",https://github.com/google-research/timesfm,,,,,,,,,,,,,,,,,,,,
02/04/2026,Clerk Skills,Coding,2,Provides specialized Clerk knowledge for coding agents across various frameworks with a single installation.,https://go.clerk.com/k05qkUw?utm_source=tldrai,,,,,,,,,,,,,,,,,,,,
02/04/2026,Transformers.js v4,Coding,2,"A JavaScript library featuring a new WebGPU Runtime, enabling the use of transformers.js code across various JavaScript environments.",https://github.com/huggingface/transformers.js/releases/tag/4.0.0,,,,,,,,,,,,,,,,,,,,
02/04/2026,The Code Newsletter,Coding,2,"A newsletter that teaches AI coding techniques, tools, and workflows used by top engineers, aiming to cut coding time in half and provide tech insights.",https://magic.beehiiv.com/v1/5f7ce6e3-9a71-416b-99a7-606c5f7e2447?email=ellahazan55@gmail.com&red%5B%E2%80%A6%5D1-46c4-8722-878d417fab5c&utm_source=sh_ad&utm_campaign=29_11,,,,,,,,,,,,,,,,,,,,
02/04/2026,Softr's AI Co-Builder,Coding,2,An AI app builder that creates working business software like portals and internal tools with a visual editor and zero code.,https://www.softr.io/build-with/tldr-product?utm_source=tldr_product&utm_medium=influencer&utm_campaign=ai_co-builder&utm_content=tldrproduct_march_launch_post,,,,,,,,,,,,,,,,,,,,
02/04/2026,NVIDIA NemoClaw,Coding,2,"Wraps the OpenClaw framework inside ""OpenShell,"" a secure sandbox that applies OS-level restrictions, tightly controlling agent access and integrating with Nemotron models for data governance.",https://www.digitalocean.com/blog/production-inference-era-nvidia-gtc?utm_source=tldrdevops,,,,,,,,,,,,,,,,,,,,
02/04/2026,Pretext,Coding,2,"A pure JavaScript/TypeScript browser library for fast and accurate multiline text measurement and layout, enabling new text rendering effects and circumventing costly DOM reflows.",https://github.com/chenglou/pretext?utm_source=tldrdev,,,,,,,,,,,,,,,,,,,,
02/04/2026,SQLMesh,Coding,2,"A SQL-based transformation framework that brings testing, versioning, and Terraform-like plan/apply workflows to SQL pipelines. Donated to the Linux Foundation.",https://thenewstack.io/fivetran-donates-sqlmesh-lf/?utm_source=tldrdata,,,,,,,,,,,,,,,,,,,,
02/04/2026,Agentforce in Slack,Productivity,2,"Integrates AI agents directly into Slack for smarter collaboration, eliminating new logins and context switching.",https://slack.com/resources/using-slack/how-to-get-started-with-agentforce-in-slack?d=701ed000012lq2sAAA&nc=701ed000012lon9AAA&utm_source=theneuronai&utm_medium=tp_email&utm_campaign=amer_us_slack-invoice_&utm_content=allsegments_all-strategic-theneuron-secondary-mar30_701ed000012lq2sAAA_english_how-to-get-started-with-agentforce-in-slack,,,,,,,,,,,,,,,,,,,,
02/04/2026,Codex (OpenAI),Productivity,2,"A feature within OpenAI for scheduling recurring tasks for AI agents, with plugins for various work apps.",https://developers.openai.com/codex/app/automations,,,,,,,,,,,,,,,,,,,,
02/04/2026,Tinker (Shopify),Image/Video,2,"A free mobile app offering AI creative tools for video, images, 3D models, and product photography.",https://www.tinker.com/bg,,,,,,,,,,,,,,,,,,,,
02/04/2026,Tunee,Image/Video,2,An AI tool that creates full songs from text prompts and generates finished music videos from a single conversation thread.,https://taaft.co/tunee-r,,,,,,,,,,,,,,,,,,,,
02/04/2026,Fort,Other,2,"A screenless wristband that tracks strength training (50+ exercises, reps, bar speed, range of motion, proximity to failure), sleep, stress, HRV, and cardio.",https://taaft.co/forttracker-r,,,,,,,,,,,,,,,,,,,,
02/04/2026,n8n-MCP,Productivity,2,"Provides AI assistants with extensive knowledge of n8n's workflow automation nodes, including search, validation, and real-world examples.",https://github.com/czlonkowski/n8n-mcp,,,,,,,,,,,,,,,,,,,,
02/04/2026,Claude Mythos (Capybara),Other,2,"Anthropic's leaked next-generation AI model, described as a new tier above Opus, dramatically larger and more intelligent, with significantly higher scores in coding, reasoning, and cybersecurity.",,,,,,,,,,,,,,,,,,,,,
02/04/2026,Claude (Computer Use / Code auto mode),Productivity,2,"An AI assistant that can control a Mac remotely (keyboard, mouse, apps) and features an auto mode for agents to decide safe actions independently.",https://claude.com/blog/dispatch-and-computer-use,,,,,,,,,,,,,,,,,,,,
02/04/2026,Anthropic Claude Code,Coding,2,"Provides remote PR fixes, monitors pull requests, and resolves CI failures in the cloud.",,,,,,,,,,,,,,,,,,,,,
02/04/2026,HubSpot Marketing Automation Playbook,Productivity,2,"A playbook to master marketing with AI, teaching how to use tools like Claude and ChatGPT to automate leads, emails, social content, and data analysis.",https://offers.hubspot.com/ai-marketing-automation?utm_medium=email-media-newsletter&utm_source=mindstream&utm_campaign=owned&utm_term=2026-03-27&utm_content=native-ads,,,,,,,,,,,,,,,,,,,,
02/04/2026,Superhuman AI free course (AI for Work),Productivity,2,A free course to learn how to use AI at work and get certified.,https://education.superhuman.ai/courses/aiforwork?utm_source=superhuman&utm_medium=referral&utm_campaign=interpreter-ai-that-manages-your-documents-even-offline,,,,,,,,,,,,,,,,,,,,
02/04/2026,Sentry,Productivity,2,"Tool for routing OpenTelemetry logs with minimal configuration (just 2 environment variables), enabling log management without SDK changes or re-instrumentation.",https://blog.sentry.io/structured-logging-opentelemetry/?utm_source=tldr&utm_medium=paid-community&utm_campaign=logs-fy27q1-evergreen&utm_content=newsletter-otlp-blog-quicklinks-learnmore,,,,,,,,,,,,,,,,,,,,
02/04/2026,Kubescape 4.0,Productivity,2,"Enterprise-grade runtime threat detection, AI-focused security for Kubernetes clusters, enables AI agents to scan clusters, provides security controls for KAgent AI orchestration, and features a streamlined architecture with Kubescape Storage.",https://www.cncf.io/blog/2026/03/26/announcing-kubescape-4-0-enterprise-stability-meets-the-ai-era/?utm_source=tldrdevops,,,,,,,,,,,,,,,,,,,,
02/04/2026,Oh-My-ClaudeCode (OMC),Coding,2,"Multi-agent orchestration tool for Claude Code that requires zero learning curve, uses a team-based pipeline to automate coding workflows, features deep Socratic interviews, auto-resume, portable skill files, and optional integration with external AI providers.",https://github.com/Yeachan-Heo/oh-my-claudecode?utm_source=tldrdevops,,,,,,,,,,,,,,,,,,,,
02/04/2026,Microsoft Build 2026,Other,2,"Developer conference offering access to cutting-edge models, agent capabilities, data, and compute, enabling attendees to apply the latest AI workflows and stay at the forefront of AI innovation.",https://fandf.co/4t6EwCv?utm_source=tldrnewsletter,,,,,,,,,,,,,,,,,,,,
02/04/2026,Ribbi,Image/Video,2,A self-evolving AI creative agent designed for multi-modal content generation through natural conversation.,https://ribbi.ai/,,,,,,,,,,,,,,,,,,,,
02/04/2026,AgentField,Coding,2,"An open-source control plane that enables AI agents to be callable across various parts of a tech stack, including frontends, backends, and other agents, functioning like an API.",https://agentfield.ai/github/?utm_source=thecode&utm_medium=newsletter&utm_campaign=thecode_060401&utm_id=thecode-1-github-cta&utm_content=github-cta,,,,,,,,,,,,,,,,,,,,
02/04/2026,Maestri,Coding,2,An infinite visual canvas for macOS designed for orchestrating and connecting multiple AI coding agents.,https://www.themaestri.app/en,,,,,,,,,,,,,,,,,,,,
02/04/2026,Raccoon,Productivity,2,A collaborative AI agent designed to transform user ideas into actionable outcomes.,https://raccoonai.tech/,,,,,,,,,,,,,,,,,,,,
02/04/2026,AdsCreator,Image/Video,2,"An AI tool that converts website URLs into engaging, scroll-stopping advertisements.",https://www.adscreator.com/,,,,,,,,,,,,,,,,,,,,
02/04/2026,Context7,Coding,2,A context-focused tool to make coding agents smarter.,https://app.therundown.ai/guides/make-claude-code-smarter-with-the-context7-mcp,,,,,,,,,,,,,,,,,,,,
02/04/2026,Fauna,Other,2,A built-in creative agent that handles model routing and prompting.,https://flora.ai/blog/introducing-fauna,,,,,,,,,,,,,,,,,,,,
02/04/2026,ChatGPT for Excel,Productivity,2,"An integration that allows users to build and update spreadsheets, analyze data, and review results using natural language within Excel.",https://chatgpt.com/apps/spreadsheets/,,,,,,,,,,,,,,,,,,,,
02/04/2026,Ollama 0.19,Coding,2,"Runs local AI models up to 2x faster on Macs using Apple's MLX framework, with smarter cache reuse for coding agents.",https://x.com/ollama/status/2038835449012351197,,,,,,,,,,,,,,,,,,,,
02/04/2026,Capy,Coding,2,An AI-native IDE for parallel development that runs multiple coding agents simultaneously and manages work from task to pull request.,https://capy.ai/,,,,,,,,,,,,,,,,,,,,
02/04/2026,Bluor,Writing,2,An AI tool for creating email designs from descriptions.,https://bluor.ai/,,,,,,,,,,,,,,,,,,,,
