Date Logged,Tool Name,Category,Mentions,Description,Source Link,,,,,,,,,,,,,,,,,,,,Phase 5A running — analyzing fallback content (first half)… Thu Apr 02 2026 06:44:20 GMT+0300 (Israel Daylight Time)
02/04/2026,Replit's Agent 4,Coding,1,"A multi-agent system for building products, designed to accelerate the development and shipping process.",https://replit.com/?utm_source=newsletter&utm_medium=tldr&utm_campaign=tldr,,,,,,,,,,,,,,,,,,,,
02/04/2026,Opal (by Gemini),Productivity,1,An agent by Gemini that supports automations for recurring tasks.,https://blog.google/innovation-and-ai/models-and-research/google-labs/opal-agent/,,,,,,,,,,,,,,,,,,,,
02/04/2026,Agent Smith,Coding,1,An internal coding agent developed by Google that became highly popular among employees.,https://www.businessinsider.com/google-agent-smith-employees-ai-driven-coding-2026-3,,,,,,,,,,,,,,,,,,,,
02/04/2026,Unsloth's dynamic GGUFs,Other,1,Optimized versions of AI models that run faster on consumer hardware.,https://unsloth.ai/docs/models/tutorials,,,,,,,,,,,,,,,,,,,,
02/04/2026,Agent Toolkit (NVIDIA),Coding,1,Simplified deployment tool for AI agents.,https://www.digitalocean.com/blog/production-inference-era-nvidia-gtc?utm_source=tldrdevops,,,,,,,,,,,,,,,,,,,,
02/04/2026,Docker Agent,Coding,1,"Used in a local AI workflow to generate IT news roundups, saving cloud AI credits.",https://www.docker.com/blog/building-a-news-roundup-with-docker-agent-docker-model-runner-and-skill/?utm_source=tldrdevops,,,,,,,,,,,,,,,,,,,,
02/04/2026,Docker Model Runner,Coding,1,Used for local analysis of articles in an AI workflow.,https://www.docker.com/blog/building-a-news-roundup-with-docker-agent-docker-model-runner-and-skill/?utm_source=tldrdevops,,,,,,,,,,,,,,,,,,,,
02/04/2026,Prometheus,Productivity,1,"An open-source tool for observability, recommended for practical advice to get started.",https://chronosphere.io/resource/getting-started-with-observability-metrics-using-prometheus/?utm_source=tldr-devops&utm_medium=newsletter,,,,,,,,,,,,,,,,,,,,
02/04/2026,Apache Superset,Research,1,"An open-source business intelligence platform for data visualization, dashboard creation, and SQL querying, supporting over 40 databases.",https://github.com/apache/superset?utm_source=tldrdevops,,,,,,,,,,,,,,,,,,,,
02/04/2026,EDB Postgres,Other,1,"A sovereign AI and data platform offering hybrid management, observability, unified workloads, and sovereign Postgres environments.",https://www.enterprisedb.com/?utm_source=em&utm_medium=pa&utm_campaign=em_ww_tldr_newsletter-tai-20260323,,,,,,,,,,,,,,,,,,,,
02/04/2026,Agent Toolkit (Fastly),Coding,1,An open-source toolkit of curated skills to teach AI coding agents platform-specific workflows and patterns.,https://www.fastly.com/blog/your-ai-coding-agent-just-got-better-fastly?utm_source=tldrdevops,,,,,,,,,,,,,,,,,,,,
02/04/2026,jai,Productivity,1,"Provides an effortless, one-command solution for containing AI agents on Linux, protecting home directories.",https://jai.scs.stanford.edu/?utm_source=tldrdev,,,,,,,,,,,,,,,,,,,,
02/04/2026,Merrilin,Productivity,1,A reading app that uses a dual-lane synchronization system to manage multi-device progress and annotations.,https://tech.stonecharioteer.com/posts/2026/merrilin-local-sync/?utm_source=tldrdev,,,,,,,,,,,,,,,,,,,,
02/04/2026,Notion's AI Q&A platform,Productivity,1,"An AI Q&A platform that scaled to millions of users with optimized vector search architecture, resulting in increased onboarding, lower search costs, and improved latency.",https://www.datatinkerer.io/p/how-notion-scaled-ai-q-and-a-to-millions-of-workspaces?utm_source=tldrdata,,,,,,,,,,,,,,,,,,,,
02/04/2026,Datahike,Other,1,"A Datalog-based, immutable, Git-like database offering time-travel, versioning, distributed reads, and pluggable storage.",https://github.com/replikativ/datahike?utm_source=tldrdata,,,,,,,,,,,,,,,,,,,,
02/04/2026,Feast,Productivity,1,"A feature store with built-in monitoring using Prometheus and OpenTelemetry, enabling tracking of latency, throughput, feature retrieval, and system health.",https://feast.dev/blog/feast-feature-server-monitoring/?utm_source=tldrdata,,,,,,,,,,,,,,,,,,,,
02/04/2026,Mermaid,Productivity,1,"A tool that converts plain text, Markdown-style code, or natural language into various diagrams quickly.",https://mermaid.ai/web/?utm_source=tldrdata,,,,,,,,,,,,,,,,,,,,
02/04/2026,Bluesky (Attie),Other,1,An AI app that allows users to build custom social feeds using plain-language commands.,https://techcrunch.com/2026/03/28/bluesky-leans-into-ai-with-attie-an-app-for-building-custom-feeds/,,,,,,,,,,,,,,,,,,,,
02/04/2026,Grok Imagine V2,Image/Video,1,"An AI tool that generates 4K videos (up to 30 seconds) or photorealistic images from text prompts, with synchronized audio and the ability to animate photos.",https://grokimagine2.io/,,,,,,,,,,,,,,,,,,,,
02/04/2026,Cowork (Claude),Productivity,1,A feature within Claude for scheduling recurring tasks for AI agents.,https://support.claude.com/en/articles/13854387-schedule-recurring-tasks-in-cowork,,,,,,,,,,,,,,,,,,,,
02/04/2026,Limbic,Other,1,An AI therapy system that has shown to outperform human clinicians in a study.,https://endpoints.news/limbic-aims-to-show-ai-beats-humans-in-delivering-therapy/,,,,,,,,,,,,,,,,,,,,
02/04/2026,Google Translate’s Live Translate,Other,1,"A feature that provides live translation on iOS with any headphones, supporting over 70 languages and preserving speaker tone.",https://blog.google/products-and-platforms/products/translate/live-translate-with-headphones/,,,,,,,,,,,,,,,,,,,,
02/04/2026,ComicInk AI,Image/Video,1,"An AI tool that generates multi-panel comic strips with consistent characters, speech bubbles, and panel layouts from text prompts.",https://taaft.co/comicink-r,,,,,,,,,,,,,,,,,,,,
02/04/2026,Cresh,Productivity,1,A business idea validator that assesses concepts across 33 metrics to determine their worth before investment.,https://taaft.co/creshme-r,,,,,,,,,,,,,,,,,,,,
02/04/2026,Automateed,Writing,1,"Generates complete eBooks (150+ pages) with AI content, images, designed covers, and KDP-ready PDFs from a single text prompt.",https://taaft.co/automateed-r,,,,,,,,,,,,,,,,,,,,
02/04/2026,PaintIt AI,Image/Video,1,"Generates product photos and lifestyle images from a single product shot, replacing traditional photoshoots with AI-styled renders.",https://taaft.co/paintitai-r,,,,,,,,,,,,,,,,,,,,
02/04/2026,Crochets,Other,1,"Generates complete crochet patterns with instructions, stitch counts, and 3D previews from descriptions.",https://taaft.co/crochetssite-r,,,,,,,,,,,,,,,,,,,,
02/04/2026,Claude Subconscious,Productivity,1,Provides Claude Code with persistent memory through a background agent that offers guidance across conversations.,http://github.com/letta-ai/claude-subconscious?utm_source=newsletter.theresanaiforthat.com&utm_medium=newsletter&utm_campaign=nvidia-ceo-agi-is-already-here&_bhlid=a3ce66f1ed858fc7dcbb47952c746aa6b65d1a73,,,,,,,,,,,,,,,,,,,,
02/04/2026,Amazon Lightsail,Productivity,1,"Provides a 1-click deployment service to launch OpenClaw into a managed AWS environment, pre-configured with Amazon Bedrock, ensuring secure, scalable infrastructure.",,,,,,,,,,,,,,,,,,,,,
02/04/2026,Zenity,Coding,1,"An open-source security infrastructure framework that acts as a real-time intercept layer, inspecting agent actions to detect sensitive data and block risky shell commands.",,,,,,,,,,,,,,,,,,,,,
02/04/2026,Tesla Full Self-Driving,Other,1,"An AI capability that enables autonomous driving, praised for its ability to master complex and variable real-time environments.",,,,,,,,,,,,,,,,,,,,,
02/04/2026,Local AI Models,Other,1,"A recommendation to experiment with AI models that run on local machines, such as Mac Studios, to avoid cloud service limitations and costs.",https://www.youtube.com/watch?v=vehYE1DfkZg,,,,,,,,,,,,,,,,,,,,
02/04/2026,Beams,Coding,1,"Ephemeral, isolated runtimes introduced by Teleport, built for agentic workloads, offering fast startup, default security, and integration with infrastructure identity and audit trails.",https://fandf.co/4rXMVXZ,,,,,,,,,,,,,,,,,,,,
02/04/2026,Codex Plugins,Productivity,1,"Plugins that connect the Codex AI to various work applications like Slack, Figma, Notion, Gmail, and Google Drive, enabling it to handle planning and coordination.",https://developers.openai.com/codex/plugins,,,,,,,,,,,,,,,,,,,,
02/04/2026,Google Translate Live Translate,Productivity,1,"A feature that provides live translation for over 70 languages on iOS, working with any headphones and preserving speaker tone and cadence.",https://blog.google/products-and-platforms/products/translate/live-translate-with-headphones/,,,,,,,,,,,,,,,,,,,,
02/04/2026,Notis,Productivity,1,"An AI intern tool that offers managed security and integrates with over 800 tools, accessible from messaging platforms like WhatsApp, iMessage, Slack, and Telegram.",https://taaft.co/notis-r,,,,,,,,,,,,,,,,,,,,
02/04/2026,Upsearch,Research,1,"A tool that tracks how AI assistants display a brand, providing visibility scores, sentiment analysis, and competitor benchmarks.",https://taaft.co/upsearch-r,,,,,,,,,,,,,,,,,,,,
02/04/2026,Popularo,Productivity,1,A tool that scores social media posts before publication to predict their performance.,https://taaft.co/popularo-r,,,,,,,,,,,,,,,,,,,,
02/04/2026,BeatMV,Image/Video,1,An AI tool that converts any song into a music video by allowing users to upload a track and select a visual style.,https://taaft.co/beatmv-r,,,,,,,,,,,,,,,,,,,,
02/04/2026,Bugzy AI,Coding,1,"An AI tool that performs automated QA on pull requests and deployments, catching regressions and verifying changes.",https://taaft.co/bugzyai-r,,,,,,,,,,,,,,,,,,,,
02/04/2026,SureThing,Productivity,1,"An autonomous AI agent described as a cloud-first OpenClaw alternative with persistent memory, learning user goals, voice, and workflows across over 1,000 connected apps.",https://taaft.co/surething-s/?utm_source=taaft,,,,,,,,,,,,,,,,,,,,
02/04/2026,Ropet,Other,1,"An AI-powered robot pet that recognizes faces, reads emotions, responds to touch, runs on ChatGPT for conversations, and works offline.",https://taaft.co/ropetai-r,,,,,,,,,,,,,,,,,,,,
02/04/2026,Vit,Image/Video,1,"A tool that brings git-style version control to video editing, tracking timeline metadata as lightweight JSON.",https://github.com/LucasHJin/vit,,,,,,,,,,,,,,,,,,,,
02/04/2026,Nosh One,Other,1,"A countertop robot designed to autonomously cook full meals, monitoring food in real time with a built-in camera and supporting over 500 recipes.",https://us.letsnosh.io/,,,,,,,,,,,,,,,,,,,,
02/04/2026,AI Transformation System,Productivity,1,"A system that assesses team recordings to build sprint-by-sprint roadmaps, decodes screen captures for integration plans, and turns systems into reusable team skill files.",https://offers.hubspot.com/matg-ai-transformation-consultant?utm_medium=email-media-newsletter&utm_source=mindstream&utm_campaign=owned&utm_term=2026-03-28&utm_content=native-ads,,,,,,,,,,,,,,,,,,,,
02/04/2026,Transcript LOL,Productivity,1,"A tool that converts audio or video into accurate transcripts, summaries, and publishable content in over 70 languages, supporting various platforms like YouTube, TikTok, Zoom, and Google Drive.",https://transcript.lol/,,,,,,,,,,,,,,,,,,,,
02/04/2026,Remio,Productivity,1,"An AI tool that unifies files, meetings, emails, and web content to create a personalized AI that mimics user's thinking and working style.",https://taaft.co/remio-r,,,,,,,,,,,,,,,,,,,,
02/04/2026,Agen,Coding,1,"A platform that runs fully autonomous AI coding agents in the cloud, offering multi-repository sessions, self-fixing CI pipelines, and cross-repository live previews.",https://taaft.co/agen-r,,,,,,,,,,,,,,,,,,,,
02/04/2026,Fina Money,Productivity,1,"A modular finance tracker featuring AI categorization, bank syncing, custom dashboards, and investment monitoring.",https://taaft.co/finamoney-r,,,,,,,,,,,,,,,,,,,,
02/04/2026,Complete.dev,Productivity,1,"A platform that transforms prompts into finished deliverables, facilitating collaboration between AI agents and humans with shared context and file management.",https://taaft.co/completedev-r,,,,,,,,,,,,,,,,,,,,
02/04/2026,Parse,Productivity,1,"An AI tool that audits SaaS stacks using AI agents to identify hidden churn risks, revenue leaks, and expansion opportunities.",https://taaft.co/parse-r,,,,,,,,,,,,,,,,,,,,
02/04/2026,Dedalus Labs,Coding,1,"A platform for deploying, hosting, and monetizing production AI agents, offering multi-tenant authentication and model routing.",https://taaft.co/dedaluslabs-r,,,,,,,,,,,,,,,,,,,,
02/04/2026,Claw4S 2026,Research,1,"The world's first claw-native conference where research submissions are executable SKILL markdown files, reviewed and reproduced by AI in real time, offering prizes and promoting reproducibility.",https://taaft.co/claw4s-s,,,,,,,,,,,,,,,,,,,,
02/04/2026,AI Foundations for Absolute Beginners,Other,1,"A free course designed to teach AI literacy from scratch, covering machine learning, bias, and responsible AI.",https://www.youtube.com/watch?v=tchN4xa4pfg,,,,,,,,,,,,,,,,,,,,
02/04/2026,Accomplish,Productivity,1,"An open-source desktop AI agent that runs locally, reads files, creates documents, and automates knowledge work, supporting various AI models.",https://taaft.co/accomplishai-r,,,,,,,,,,,,,,,,,,,,
02/04/2026,Cookbook,Coding,1,"A collection of tutorials, applications, and edge deployments for building with open-weight LFM models across various devices.",https://github.com/Liquid4All/cookbook,,,,,,,,,,,,,,,,,,,,
02/04/2026,Obsidian Skills,Coding,1,"Teaches AI coding agents how to interact with Obsidian Markdown, Bases, and JSON Canvas files for various AI coding platforms.",https://github.com/kepano/obsidian-skills,,,,,,,,,,,,,,,,,,,,
02/04/2026,SynthID,Other,1,"Hidden watermark to show music was made by AI, used for copyright and AI labeling.",https://deepmind.google/models/synthid/,,,,,,,,,,,,,,,,,,,,
02/04/2026,Cline Kanban,Coding,1,Kanban board for managing coding agents that streamlines workflows by displaying task statuses and dependencies at a glance.,https://cline.bot/blog/announcing-kanban?utm_source=tldrdev,,,,,,,,,,,,,,,,,,,,
02/04/2026,Superhuman AI Top 125 AI Tools,Other,1,A curated list of the top 125 AI tools.,https://airtable.com/apppaprA2GXXxBSjs/shrjsPiubnIHIqTwH/tblCm6yevfjitvoCh/viwKzKHKKqd5d5bk8?utm_source=superhuman&utm_medium=referral&utm_campaign=interpreter-ai-that-manages-your-documents-even-offline,,,,,,,,,,,,,,,,,,,,
02/04/2026,"Superhuman AI Top 1,000 Prompts",Writing,1,"A resource to improve prompting skills with 1,000 curated prompts.",https://www.superhuman.ai/c/1000_chatgpt_prompts,,,,,,,,,,,,,,,,,,,,
02/04/2026,Flowershow,Writing,1,"Platform that allows users to publish Markdown content as websites for blogs, documentation, and knowledge bases, offering various features including demos, themes, and a command-line interface.",https://flowershow.app/?utm_source=tldrdesign,,,,,,,,,,,,,,,,,,,,
02/04/2026,Pascal Editor,Image/Video,1,"3D building tool using React Three Fiber and WebGPU for creating architectural projects through a modular Turborepo architecture, enabling real-time geometry updates and interactive 3D design.",https://github.com/pascalorg/editor?utm_source=tldrdev,,,,,,,,,,,,,,,,,,,,
02/04/2026,SuperSplat Editor,Image/Video,1,"Free, open-source, web-based tool designed for inspecting, editing, optimizing, and publishing 3D Gaussian Splats.",https://github.com/playcanvas/supersplat?utm_source=tldrdev,,,,,,,,,,,,,,,,,,,,
02/04/2026,Spacelift,Productivity,1,"Offers broader, automated detection and workflows for Terraform/OpenTofu infrastructure drift, comparing actual resources to state and enabling scheduled checks and alerts.",https://spacelift.io/blog/terraform-cloud-drift-detection?utm_source=tldrdevops,,,,,,,,,,,,,,,,,,,,
02/04/2026,AgentScope,Coding,1,"Production-ready agent framework for Python 3.10+ to build agentic LLM applications with voice capabilities, real-time interruption support, and reinforcement learning integration, including MCP tool integration and multi-agent conversation pipelines.",https://github.com/agentscope-ai/agentscope?utm_source=tldrdevops,,,,,,,,,,,,,,,,,,,,
02/04/2026,BidHelm,Productivity,1,"Runs AI agents to optimize Google Ads campaigns, cut wasted spend, and add negative keywords automatically.",https://taaft.co/bidhelm-r,,,,,,,,,,,,,,,,,,,,
02/04/2026,Whacka,Coding,1,"Turns ideas into real, working apps directly from your phone, bringing vibe coding to mobile for non-technical creators.",https://taaft.co/whacka-r,,,,,,,,,,,,,,,,,,,,
02/04/2026,Pounce,Productivity,1,Streams X and Reddit conversations to your inbox in real time and drafts replies in your voice to grow followers faster.,https://taaft.co/pounce-r,,,,,,,,,,,,,,,,,,,,
02/04/2026,PixelLab,Image/Video,1,"Generates pixel art game assets with AI, including sprite animations, rotations, tilesets, and UI elements for indie developers.",https://taaft.co/pixellab-r,,,,,,,,,,,,,,,,,,,,
02/04/2026,Loom,Productivity,1,"Records your screen and automatically generates bug reports, pushing them into Jira, saving time and providing full context.",https://taaft.co/atlassian170326-s,,,,,,,,,,,,,,,,,,,,
02/04/2026,Timekettle X1,Other,1,A pocket-sized AI interpreter hub with wireless earbuds that translates 40 languages with 93 accents in real time across five modes.,https://www.timekettle.co/products/x1-ai-interpreter-hub,,,,,,,,,,,,,,,,,,,,
02/04/2026,Dev Browser,Coding,1,"Provides browser automation for AI coding agents through sandboxed scripts with persistent pages, DOM snapshots, and Chrome extension support.",https://github.com/SawyerHood/dev-browser,,,,,,,,,,,,,,,,,,,,
02/04/2026,hf-mount,Coding,1,"Attaches Hugging Face Hub storage, models, and datasets as a local filesystem.",,,,,,,,,,,,,,,,,,,,,
02/04/2026,Bright Data CLI,Coding,1,"An open-source CLI with anti-bot bypass, CAPTCHA solving, and JS rendering, allowing AI agents to browse and extract data from any URL.",,,,,,,,,,,,,,,,,,,,,
02/04/2026,use_figma MCP tool,Image/Video,1,A tool that allows AI agents to design directly on the Figma canvas.,,,,,,,,,,,,,,,,,,,,,
02/04/2026,ElevenLabs CLI,Coding,1,An agent-friendly CLI for ElevenLabs services.,https://substack.com/redirect/15a392e0-5ba3-4654-8dc0-77ffe6e7e0be?j=eyJ1CiOiI3eG81NmIifQ.YBzePDZcx7ReocSEl7uMk3B2be1RYJqiTBygCGjCYtU,,,,,,,,,,,,,,,,,,,,
02/04/2026,Auto-Inference-Optimiser,Coding,1,An AI agent that optimizes LLM inference speed while maintaining quality on Apple Silicon.,https://links.tldrnewsletter.com/4HSwWd,,,,,,,,,,,,,,,,,,,,
02/04/2026,Devin,Coding,1,"An AI software engineer that can build software from start to finish without human involvement, allowing engineers to focus on higher-value tasks.",,,,,,,,,,,,,,,,,,,,,
02/04/2026,Caterpillar,Coding,1,A security scanner for AI skills that scans for anti-patterns before user download.,https://github.com/alice-dot-io/caterpillar?utm_source=tldrinfosec,,,,,,,,,,,,,,,,,,,,
02/04/2026,Escape,Coding,1,"An offensive security platform using automated agents to discover, test, and fix application vulnerabilities within engineering workflows.",https://escape.tech/?utm_source=tldrinfosec,,,,,,,,,,,,,,,,,,,,
02/04/2026,Veo,Image/Video,1,Generates videos or animations for advertisers without a production team.,https://x.com/GoogleAds/status/2036547990236659798,,,,,,,,,,,,,,,,,,,,
02/04/2026,Anima,Coding,1,"Design-aware AI agent that generates production-ready apps from Figma files, URLs, or prompts.",https://www.animaapp.com/?utm_source=tldrdesign,,,,,,,,,,,,,,,,,,,,
02/04/2026,Optio,Coding,1,Workflow orchestration system that fully automates the software development process using AI agents.,https://github.com/jonwiggins/optio?utm_source=tldrdev,,,,,,,,,,,,,,,,,,,,
02/04/2026,Surge AI,Other,1,Provides reinforcement learning environments for training AI models.,https://surgehq.ai/,,,,,,,,,,,,,,,,,,,,
02/04/2026,Lindy,Productivity,1,"Secure, personal AI agent that runs your work day from iMessage.",,,,,,,,,,,,,,,,,,,,,
02/04/2026,Lemon,Writing,1,AI voice assistant that helps write and respond to emails faster.,,,,,,,,,,,,,,,,,,,,,
02/04/2026,Decksy,Productivity,1,"Creates researched, professional slides from topics, text, or uploaded documents.",,,,,,,,,,,,,,,,,,,,,
02/04/2026,Diagrimo,Image/Video,1,Turns text or ideas into clear diagrams and infographics.,,,,,,,,,,,,,,,,,,,,,
02/04/2026,Volga,Coding,1,"Fully Rust-based engine for real-time AI/ML data processing, unifying streaming, batch, and request-time compute.",https://volgaai.substack.com/p/volga-a-rust-rewrite-of-a-real-time?utm_source=tldrdata,,,,,,,,,,,,,,,,,,,,
02/04/2026,dbt's Fusion engine,Coding,1,"Delivers TypeScript-like transformation for SQL development with real-time type checking, intelligent autocomplete, and automated refactoring.",https://roundup.getdbt.com/p/sql-typescript-and-agents?utm_source=tldrdata,,,,,,,,,,,,,,,,,,,,
02/04/2026,Flowtica Scribe,Productivity,1,"An AI-powered recorder built inside a working pen that records, transcribes, and creates searchable summaries while writing on paper.",None provided,,,,,,,,,,,,,,,,,,,,
02/04/2026,Stickerbox,Other,1,An AI-powered printer for kids that lets them speak out an idea and instantly print it as a black-and-white sticker.,None provided,,,,,,,,,,,,,,,,,,,,
02/04/2026,Perigon Signals,Research,1,"An AI monitor that tracks important trends, topics, or competitors and delivers clean briefings straight to Slack or inbox, helping users know first and move faster.",None provided,,,,,,,,,,,,,,,,,,,,
02/04/2026,Nebius,Coding,1,"A platform for teams shipping AI at scale, allowing them to run open-source LLMs in real production, capture live traffic, fine-tune, optimize, and deploy checkpoints to dedicated GPU endpoints.",None provided,,,,,,,,,,,,,,,,,,,,
02/04/2026,Kling AI,Image/Video,1,"Its new Multi Elements feature lets you easily add, remove, or replace any object in videos with your own products without complex video editing skills.",None provided,,,,,,,,,,,,,,,,,,,,
02/04/2026,Grok Workspaces,Productivity,1,A feature that lets you create dedicated AI assistants for specific tasks like reviewing contracts and legal documents with document upload capabilities.,None provided,,,,,,,,,,,,,,,,,,,,
02/04/2026,OpenAI Codex CLI,Coding,1,"A coding agent that runs in your terminal, letting you explain, modify, and create code using natural language commands.",None provided,,,,,,,,,,,,,,,,,,,,
02/04/2026,Windsurf AI,Coding,1,An AI tool for building and deploying robust mobile applications.,None provided,,,,,,,,,,,,,,,,,,,,
02/04/2026,ChatGPT Operator,Productivity,1,"OpenAI’s new Operator assistant inside ChatGPT for practical tasks like submitting forms, applying to jobs, and ordering items.",None provided,,,,,,,,,,,,,,,,,,,,
02/04/2026,Synthesia,Image/Video,1,"A tool for creating customized, high-conversion video messages that scale to hundreds of prospects without sacrificing the personal touch.",None provided,,,,,,,,,,,,,,,,,,,,
02/04/2026,HeyGen,Image/Video,1,An AI tool to translate videos into any language.,None provided,,,,,,,,,,,,,,,,,,,,
02/04/2026,Obsidian,Productivity,1,A tool used in conjunction with Claude Cowork to triple output.,None provided,,,,,,,,,,,,,,,,,,,,
02/04/2026,Eleven Labs,Other,1,A tool for creating an AI assistant with its own phone number (voice AI).,None provided,,,,,,,,,,,,,,,,,,,,
02/04/2026,Bland AI (Norm),Other,1,"A voice AI assistant that lets anyone create a fully functional phone agent by simply describing what they need, auto-generating the prompt, agent logic, conditions, and integrations instantly.",None provided,,,,,,,,,,,,,,,,,,,,
02/04/2026,Teleport (Beams),Coding,1,"Allows users to run agents securely with identity, control, and trusted runtimes built in for agentic AI across infrastructure.",None provided,,,,,,,,,,,,,,,,,,,,
02/04/2026,Slackbot agent in Slack,Productivity,1,"An AI agent in Slack with 30 new capabilities, including reusable skills, MCP connections, and desktop operation.",None provided,,,,,,,,,,,,,,,,,,,,
02/04/2026,Copilot Researcher,Research,1,"A multi-model system that can review and edit research reports, using features like Critique and Model Council to run systems side by side and flag agreements/disagreements.",None provided,,,,,,,,,,,,,,,,,,,,
02/04/2026,Model Council,Research,1,"A mode within Copilot Researcher that runs two models side by side, flagging where they agree, where they split, and what each uniquely surfaced.",None provided,,,,,,,,,,,,,,,,,,,,
02/04/2026,Rime,Other,1,"The enterprise TTS platform built for businesses where voice quality is non-negotiable, offering human-quality AI voices that callers are 61% less likely to hang up on.",None provided,,,,,,,,,,,,,,,,,,,,
02/04/2026,Unwrap Customer Intelligence,Research,1,A tool to turn unstructured customer feedback into data-backed insights that inform your product roadmap.,None provided,,,,,,,,,,,,,,,,,,,,
02/04/2026,Notebook LM,Research,1,A tool for isolating articles of each topic into separate notebooks to help with disciplined synthesis of ideas.,None provided,,,,,,,,,,,,,,,,,,,,
02/04/2026,Adapt,Productivity,1,"An AI computer for companies that connects tools, learns business processes, and takes action directly in Slack.",,,,,,,,,,,,,,,,,,,,,
02/04/2026,Phota Studio,Image/Video,1,A personalized photo editing and generation AI model.,,,,,,,,,,,,,,,,,,,,,
02/04/2026,Claude Sonnet,Other,1,An AI model recommended for use as an orchestrator to save on tokens/costs.,,,,,,,,,,,,,,,,,,,,,
02/04/2026,Scrunch,Other,1,"Helps users see how AI interprets their site, runs free audits, and unlocks new ways to reach customers.",,,,,,,,,,,,,,,,,,,,,
