Date Logged,Tool Name,Category,Mentions,Description,Source Link,,,,,,,,,,,,,,,,,,,,Phase 5A running — analyzing fallback content (first half)… Thu Apr 02 2026 06:44:20 GMT+0300 (Israel Daylight Time)
02/04/2026,Diploi,Coding,2,A tool for hosting applications with minimal effort.,https://diploi.com/,,,,,,,,,,,,,,,,,,,,
02/04/2026,Enia,Coding,2,An AI tool that proactively refines code and learns coding standards.,https://www.eniacode.com/,,,,,,,,,,,,,,,,,,,,
02/04/2026,TopView,Image/Video,2,An AI video generator that turns products into viral videos.,https://www.topview.ai/ai-video-generator,,,,,,,,,,,,,,,,,,,,
02/04/2026,Clico,Writing,2,A browser extension that pulls context from open tabs to assist with writing directly on the page.,https://taaft.co/tryclico-s/?utm_source=taaft&utm_medium=referral,,,,,,,,,,,,,,,,,,,,
02/04/2026,BeatMusic,Image/Video,2,A platform that brings every top AI music model into one place to generate royalty-free tracks.,https://taaft.co/beatmusic-r,,,,,,,,,,,,,,,,,,,,
02/04/2026,GetSpiced,Productivity,2,An AI mentor for entrepreneurs and creators providing personalized business guidance and accountability on demand.,https://taaft.co/getspiced-r,,,,,,,,,,,,,,,,,,,,
02/04/2026,NotebookLM,Productivity,2,"A research manager that stays grounded in uploaded sources, rapidly produces briefing-quality artifacts with citations, and includes Audio/Video Overviews and Mind Maps.",https://www.youtube.com/watch?v=XRere_JdIPo,,,,,,,,,,,,,,,,,,,,
02/04/2026,Autonoma,Coding,2,"A tool that spawns AI agents to navigate and test web and mobile applications, identifying bugs in user flows.",https://www.vpdae.com/redirect/jlh7mh6y0w6vx0k63i9zfjr5ekz,,,,,,,,,,,,,,,,,,,,
02/04/2026,Udio,Image/Video,2,"A ""one-click recording studio"" for customized music, offering free experimentation and paid tiers for longer tracks and commercial use.",,,,,,,,,,,,,,,,,,,,,
02/04/2026,Conductor,Writing,2,"An enterprise AEO platform that automates content creation with intelligent, real-time search data to help content get found in AI search.",https://www.conductor.com/lp/get-started-conductor-intro/?utm_medium=paid_email&utm_source=superhuman&utm_campaign=SH_PaidEmail_Newsletter_DemoRequestCampaignsPage_US&utm_content=FeaturedToolsAd,,,,,,,,,,,,,,,,,,,,
02/04/2026,Venn,Productivity,2,An AI tool to delegate real work to AI agents with safety guardrails.,https://www.venn.ai/,,,,,,,,,,,,,,,,,,,,
02/04/2026,Lightning Rod,Research,2,A tool to turn real-world data into training datasets fast.,https://www.lightningrod.ai/,,,,,,,,,,,,,,,,,,,,
02/04/2026,Agentplace,Productivity,2,"A platform to create and use specialized agents for tasks and workflows, acting as AI teammates.",https://agentplace.io/,,,,,,,,,,,,,,,,,,,,
02/04/2026,Scalify,Coding,2,An AI tool to create websites in under 10 minutes.,https://www.scalify.ai/,,,,,,,,,,,,,,,,,,,,
02/04/2026,Fastlane,Writing,2,An AI tool to create viral content for products in seconds.,https://www.usefastlane.ai/,,,,,,,,,,,,,,,,,,,,
02/04/2026,Zeus,Productivity,2,"A highly autonomous agent for finishing complex, long tasks.",https://zeus.rocks/,,,,,,,,,,,,,,,,,,,,
02/04/2026,Replit,Coding,2,An AI tool to build web and mobile apps with simple prompts.,https://replit.com/,,,,,,,,,,,,,,,,,,,,
02/04/2026,Rime CLI,Other,2,"CLI tool for synthesizing AI voices with 100+ options, offering flagship quality or ultra-low latency.",,,,,,,,,,,,,,,,,,,,,
02/04/2026,Lakebase,Coding,2,"Serverless Postgres DB that allows instant branching, scaling, and running AI apps and agents.",https://ad.doubleclick.net/ddm/trackclk/N2655160.3973022TLDR/B35151171.442761163;dc_trk_aid=636354555;dc_trk_cid=252760689;dc_lat=;dc_rdid=;tag_for_child_directed_treatment=;tfua=;gdpr=${GDPR};gdpr_consent=${GDPR_CONSENT_755};ltd=;dc_tdv=1,,,,,,,,,,,,,,,,,,,,
02/04/2026,Trino Gateway,Other,2,"Provides a single unified connection URL to automatically route queries to the best Trino cluster, solving complexity at scale.",https://links.tldrnewsletter.com/jT4oSB,,,,,,,,,,,,,,,,,,,,
02/04/2026,Lindy AI,Productivity,2,"An AI tool to build autonomous AI agents that handle repetitive workflows across multiple applications, allowing you to delegate entire processes.",None provided,,,,,,,,,,,,,,,,,,,,
02/04/2026,Gamma,Productivity,2,"An AI product for creating slides, designed for users who dislike PowerPoint.",None provided,,,,,,,,,,,,,,,,,,,,
02/04/2026,Google Workspace Studio,Productivity,2,A free tool to automate Gmail and create agentic workflows.,None provided,,,,,,,,,,,,,,,,,,,,
02/04/2026,Zapier,Productivity,2,"An automation platform that emphasizes AI fluency, integrating AI competency into its hiring and operations, and offering easy automations across workflows.",,,,,,,,,,,,,,,,,,,,,
02/04/2026,Eightfold AI,Productivity,2,"The most complete AI tool for HR, acting as a ""brain upgrade"" for legacy HR suites, uncovering hidden talent and cutting manual work with Copilots and Agentic AI.",,,,,,,,,,,,,,,,,,,,,
02/04/2026,Remodex,Productivity,2,"An application that allows users to control Codex, running on a Mac, from an iPhone.",https://substack.com/redirect/8f1df37e-9b14-426b-a06b-23bfca8b804a?j=eyJ1IjoiN3hvNTZiIn0.YBzePDZcx7ReocSEl7uMk3B2be1RYJqiTBygCGjCYtU,,,,,,,,,,,,,,,,,,,,
02/04/2026,Pico,Productivity,2,"An application that allows users to control pi-coding-agent, running on any machine, from any mobile device.",https://substack.com/redirect/52cc18e8-de8f-4e80-bbbe-8dd2322df225?j=eyJ1IjoiN3hvNTZiIn0.YBzePDZcx7ReocSEl7uMk3B2be1RYJqiTBygCGjCYtU,,,,,,,,,,,,,,,,,,,,
02/04/2026,here.now sites,Coding,2,"A website building tool that can now connect to external services like Supabase, OpenRouter, Stripe, and Resend without needing a backend, praised by the author as a favorite tool that has improved.",https://substack.com/redirect/9e9ea75d-28d9-4b20-8a03-64f7852eac7c?j=eyJ1IjoiN3hvNTZiIn0.YBzePDZcx7ReocSEl7uMk3B2be1RYJqiTBygCGjCYtU,,,,,,,,,,,,,,,,,,,,
02/04/2026,Hyperbox,Productivity,2,"A service that allows users to rent Mac-minis as virtual computers, useful for creating sandboxed environments for AI agents.",https://substack.com/redirect/ee58c08d-e1bf-49b6-b8f1-0ccb98b2df14?j=eyJ1IjoiN3hvNTZiIn0.YBzePDZcx7ReocSEl7uMk3B2be1RYJqiTBygCGjCYtU,,,,,,,,,,,,,,,,,,,,
02/04/2026,Chroma’s Context-1,Research,2,A custom model by Chroma designed as a better search agent for specific use cases.,https://substack.com/redirect/7862aaef-d3dd-4630-99ef-27a0b11e891d?j=eyJ1IjoiN3hvNTZiIn0.YBzePDZcx7ReocSEl7uMk3B2be1RYJqiTBygCGjCYtU,,,,,,,,,,,,,,,,,,,,
02/04/2026,Intercom’s Apex 1.0,Productivity,2,A custom model by Intercom that helps their agent Fin achieve a higher resolution rate in customer interactions.,,,,,,,,,,,,,,,,,,,,,
02/04/2026,Microsoft Researcher,Research,2,A tool with multi-model intelligence and a Critique capability to cross-check AI-generated reports for accuracy and depth.,https://techcommunity.microsoft.com/blog/microsoft365copilotblog/introducing-multi-model-intelligence-in-researcher/4506011,,,,,,,,,,,,,,,,,,,,
02/04/2026,Notion MCP,Productivity,2,"A tool that allows connecting AI agents directly to a Notion workspace for reading, writing, and operating within pages.",https://developers.notion.com/guides/mcp/mcp,,,,,,,,,,,,,,,,,,,,
02/04/2026,LM Studio,Other,2,"A free application for downloading and chatting with local AI models, also indicating hardware compatibility.",https://lmstudio.ai/docs/app/basics,,,,,,,,,,,,,,,,,,,,
02/04/2026,Unsloth Studio,Other,2,A free application for downloading and chatting with local AI models.,https://unsloth.ai/,,,,,,,,,,,,,,,,,,,,
02/04/2026,Podcast Transcript,Research,2,An AI tool that generates full transcripts and summaries for podcast episodes from Spotify or Apple Podcasts quickly.,https://podcasttranscript.ai/,,,,,,,,,,,,,,,,,,,,
02/04/2026,Ordo,Productivity,2,"A tool that saves and automatically organizes links, videos, or articles into folders and tags for easy retrieval.",https://ordoapp.online/,,,,,,,,,,,,,,,,,,,,
02/04/2026,Pensieve,Productivity,2,"A tool that connects to a company's existing tools (docs, messages, calls, code) to build a living knowledge graph, providing full context for AI agents.",https://pensieve.uk/,,,,,,,,,,,,,,,,,,,,
02/04/2026,Beams (Teleport),Productivity,2,"Ephemeral, isolated runtimes introduced by Teleport, built for agentic workloads, offering fast start, default lockdown, and identity-wired infrastructure with audit trails.",https://fandf.co/4rXMVXZ,,,,,,,,,,,,,,,,,,,,
02/04/2026,OpenRouter,Productivity,2,"A tool that helps users diversify their AI stack, presumably by providing access to multiple models.",https://openrouter.ai/,,,,,,,,,,,,,,,,,,,,
02/04/2026,Expect,Coding,2,"An open-source tool that allows agents to test code in a real browser, providing video recordings of bugs found for easier debugging and iteration.",https://github.com/millionco/expect,,,,,,,,,,,,,,,,,,,,
02/04/2026,Codebase-to-Course,Coding,2,An AI tool that converts any code repository into an interactive HTML tutorial using Claude Code Skills.,https://aidisruption.ai/p/one-command-to-turn-any-code-repository,,,,,,,,,,,,,,,,,,,,
02/04/2026,Stripe CLI,Coding,2,"A command-line interface tool for pulling revenue data, managing subscriptions, and testing payments.",,,,,,,,,,,,,,,,,,,,,
02/04/2026,Playwright,Coding,2,"A tool that allows agents to control a web browser for tasks such as navigation, clicking, filling forms, and taking screenshots.",,,,,,,,,,,,,,,,,,,,,
02/04/2026,AWS CLI,Coding,2,"A command-line interface tool for managing AWS cloud services, including spinning up servers, managing databases, and scaling infrastructure.",,,,,,,,,,,,,,,,,,,,,
02/04/2026,Vercel CLI,Coding,2,A command-line interface tool that enables deploying a website live with a single command.,,,,,,,,,,,,,,,,,,,,,
02/04/2026,Chronicle,Productivity,2,"An AI tool for slides that turns ideas and notes into stunning, professional decks in minutes.",https://substack.com/redirect/6038a8b2-dee6-4b08-8a9d-8c9c76e5571f?j=eyJ1IjoiN3hvNTZiIn0.YBzePDZcx7ReocSEl7uMk3B2be1RYJqiTBygCGjCYtU,,,,,,,,,,,,,,,,,,,,
02/04/2026,Paper Snapshot,Coding,2,A tool that allows users to snapshot a live website and paste it into Paper as editable HTML/CSS layers.,https://substack.com/redirect/252a6647-a23a-459f-bd7d-67cade49428?j=eyJ1IjoiN3hvNTZiIn0.YBzePDZcx7ReocSEl7uMk3B2be1RYJqiTBygCGjCYtU,,,,,,,,,,,,,,,,,,,,
02/04/2026,Ghostwriter by Sierra,Coding,2,A tool that enables users to chat with an agent to build additional AI agents.,https://substack.com/redirect/09703d34-295e-4035-9803-286b9f8daeb4?j=eyJ1IjoiN3hvNTZiIn0.YBzePDZcx7ReocSEl7uMk3B2be1RYJqiTBygCGjCYtU,,,,,,,,,,,,,,,,,,,,
02/04/2026,BrowserBase,Research,2,A tool that enables deep research capabilities directly from the command-line interface.,,,,,,,,,,,,,,,,,,,,,
02/04/2026,Feynman,Research,2,"A CLI tool that allows users to read papers, conduct research, and obtain cited meta-analysis for their questions.",https://substack.com/redirect/123029c4-67fd-49f2-a416-66c41f2310c0?j=eyJ1IjoiN3hvNTZiIn0.YBzePDZcx7ReocSEl7uMk3B2be1RYJqiTBygCGjCYtU,,,,,,,,,,,,,,,,,,,,
02/04/2026,Lil Agents,Productivity,2,"Tiny, open-source AI companions that reside above the user's dock, each with its own Claude session and mini window.",https://substack.com/redirect/d69940cc-3941-49f4-87e2-06e2e335cfa9?j=eyJ1IjoiN3hvNTZiIn0.YBzePDZcx7ReocSEl7uMk3B2be1RYJqiTBygCGjCYtU,,,,,,,,,,,,,,,,,,,,
02/04/2026,OutSystems,Coding,2,"A platform for developers to build, deploy, and scale AI-powered applications and agentic applications with full control.",https://www.outsystems.com/Platform/Signup?utm_source=dzone&utm_medium=display&utm_campaign=am-us-dis-2026-02-26-dzone-devrel-ads&utm_term=newsletter&utm_content=personal-environment&utm_campaignteam=community&utm_partner=none,,,,,,,,,,,,,,,,,,,,
02/04/2026,ElevenLabs,Other,2,"The gold standard for lifelike synthetic speech, offering instant cloning and multi-lingual dubbing for voices on demand.",,,,,,,,,,,,,,,,,,,,,
02/04/2026,Tinker by Shopify,Image/Video,2,"Provides free AI creative tools for video, images, 3D models, and product photography from a phone.",,,,,,,,,,,,,,,,,,,,,
02/04/2026,Dell AI Factory with NVIDIA,Other,2,"A comprehensive solution for enterprises to implement operational AI, offering AI-ready PCs, servers, storage, networking, and services, with expert support.",,,,,,,,,,,,,,,,,,,,,
02/04/2026,Gemini Live,Other,2,"A new multimodal AI model that processes text, images, audio, and video to output text and audio, noted for being better at following complex voice instructions than rivals.",,,,,,,,,,,,,,,,,,,,,
02/04/2026,bash,Coding,2,"A general-purpose command-line interface tool that agents can use for tasks like organizing files, creating directories, and image editing.",,,,,,,,,,,,,,,,,,,,,
02/04/2026,mogrify,Image/Video,2,"An image-editing tool that can resize images and edit files in place, useful for agents performing image manipulation tasks.",,,,,,,,,,,,,,,,,,,,,
02/04/2026,Figma canvas,Image/Video,2,"A design platform whose canvas is now open to AI agents, allowing them to design directly using a new MCP tool.",,,,,,,,,,,,,,,,,,,,,
02/04/2026,companies.sh,Coding,2,"An open standard and tool for ""Agent Companies"" that allows users to import and run entire companies with a single command.",companies.sh,,,,,,,,,,,,,,,,,,,,
02/04/2026,Apixo,Coding,1,"Provides developers with a single API to access various AI models for image, video, audio, and text across different providers, featuring auto failover and transparent pricing.",https://taaft.co/apixo-r,,,,,,,,,,,,,,,,,,,,
02/04/2026,Oniichan,Image/Video,1,"Generates illustrated manga pages rapidly, featuring consistent characters, dynamic panels, and cinematic storytelling in minutes.",https://taaft.co/oniichan-r,,,,,,,,,,,,,,,,,,,,
02/04/2026,Klayn,Image/Video,1,"Transforms product photos into full e-commerce photoshoots, adding studio-quality backgrounds, models, and lifestyle scenes.",https://taaft.co/klayn-r,,,,,,,,,,,,,,,,,,,,
02/04/2026,SportBot AI,Other,1,"Provides sports predictions, including verified ROI tracking, bankroll management tools, and real-time match analysis.",https://taaft.co/sportbotai-r,,,,,,,,,,,,,,,,,,,,
02/04/2026,AppDeploy,Coding,1,"Enables deployment of apps created with ChatGPT and Claude directly to a live URL, eliminating the need for infrastructure setup or hosting configuration.",https://taaft.co/appdeploy-r,,,,,,,,,,,,,,,,,,,,
02/04/2026,FastBots,Other,1,"An AI tool that creates chatbots trained on business data from a website URL, featuring a setup wizard for quick deployment.",https://taaft.co/fastbots-r,,,,,,,,,,,,,,,,,,,,
02/04/2026,Linked Helper,Productivity,1,"A workspace for managing LinkedIn outreach sequences, profile visits, and CRM syncing across campaigns.",https://taaft.co/linkedhelper-r,,,,,,,,,,,,,,,,,,,,
02/04/2026,Harness,Coding,1,"A meta-skill for Claude Code that designs domain-specific agent teams, defines specialized agents, and auto-generates the skills they use.",https://github.com/revfactory/harness,,,,,,,,,,,,,,,,,,,,
02/04/2026,AI-Scientist-v2,Research,1,"An AI tool by Sakana AI that generates hypotheses, runs experiments, and writes scientific manuscripts suitable for peer review.",https://github.com/SakanaAI/AI-Scientist-v2,,,,,,,,,,,,,,,,,,,,
02/04/2026,skill.color-expert,Other,1,"An agent skill with 113 references covering color spaces, accessibility, palette generation, and pigment mixing.",https://github.com/meodai/skill.color-expert,,,,,,,,,,,,,,,,,,,,
02/04/2026,TRL v1,Coding,1,"A post-training library for open models, released by Hugging Face, featuring over 75 methods including SFT and DPO.",,,,,,,,,,,,,,,,,,,,,
02/04/2026,Agent Lightning,Coding,1,A trainer that can transform any agent into an optimizable system without requiring code changes.,https://github.com/microsoft/agent-lightning?utm_source=tldrai,,,,,,,,,,,,,,,,,,,,
02/04/2026,frp,Coding,1,A fast reverse proxy that enables exposing a local server behind a NAT or firewall to the internet.,https://github.com/fatedier/frp?utm_source=tldrinfosec,,,,,,,,,,,,,,,,,,,,
02/04/2026,PolarDNS,Coding,1,"A Python-based authoritative DNS server designed for security testing of DNS resolvers, clients, libraries, and parsers, offering features to generate malformed and pathological DNS responses for research into various attacks.",https://github.com/oryxlabs/PolarDNS?utm_source=tldrinfosec,,,,,,,,,,,,,,,,,,,,
02/04/2026,Heretic,Other,1,A tool designed to remove censorship from transformer-based language models without requiring expensive post-training.,https://github.com/p-e-w/heretic?utm_source=tldrinfosec,,,,,,,,,,,,,,,,,,,,
02/04/2026,QuiverAI,Image/Video,1,"An AI platform building foundational models for generating, editing, and animating vector graphics, including logos, typography, illustrations, and animations.",https://quiver.ai/?utm_source=tldrdesign,,,,,,,,,,,,,,,,,,,,
02/04/2026,Paper,Coding,1,"A platform that reimagines design as a single, code-based canvas connected to apps, data, and AI agents, aiming to eliminate handoffs and provide a seamless path from idea to shipped interface.",https://paper.design?utm_source=tldrdesign,,,,,,,,,,,,,,,,,,,,
02/04/2026,Claw Code,Coding,1,"A rapid, AI-assisted Python rewrite of the leaked Claude Code agent harness, with a Rust implementation in progress for a faster, memory-safe runtime.",https://github.com/instructkr/claw-code?utm_source=tldrdev,,,,,,,,,,,,,,,,,,,,
02/04/2026,Sugar High,Coding,1,"A super lightweight syntax highlighter offering customizable, language-aware code highlighting for various programming languages with theme support.",https://sugar-high.vercel.app/?utm_source=tldrdev,,,,,,,,,,,,,,,,,,,,
02/04/2026,pg_textsearch,Coding,1,"A production-ready PostgreSQL extension that provides modern, high-performance, BM25-ranked full-text search capabilities.",https://github.com/timescale/pg_textsearch?utm_source=tldrdev,,,,,,,,,,,,,,,,,,,,
02/04/2026,Spacelift Intent,Coding,1,"An AI-assisted infrastructure approach that allows developers to request resources in natural language while platform teams enforce policies, accelerating development and integrating with IaC and GitOps workflows.",https://spacelift.io/blog/what-we-learned-from-platform-teams-using-spacelift-intent?utm_source=tldrdevops,,,,,,,,,,,,,,,,,,,,
02/04/2026,Octopus,Coding,1,"Octopus's step verification feature for Argo CD integrations, which allows deployments to wait for application sync and health, improving accuracy and visibility in GitOps-based delivery workflows.",https://octopus.com/blog/argo-cd-verified-deployments?utm_source=tldrdevops,,,,,,,,,,,,,,,,,,,,
02/04/2026,Claude-Howto,Other,1,"A comprehensive learning guide for Claude Code, teaching users to master advanced features like slash commands, memory systems, and subagents through templates and tutorials, aiming to unlock 90% of Claude Code's power.",https://github.com/luongnv89/claude-howto?utm_source=tldrdevops,,,,,,,,,,,,,,,,,,,,
02/04/2026,Aurora,Coding,1,An open-source RL framework that turns speculative decoding into a self-improving system that learns from live traffic.,https://www.together.ai/blog/aurora,,,,,,,,,,,,,,,,,,,,
02/04/2026,TAAFT Ultimate Prompt Pack,Writing,1,"A collection of prompts to get better responses from AI models like ChatGPT, Claude, and Gemini.",,,,,,,,,,,,,,,,,,,,,
02/04/2026,Sharix,Research,1,Interrogates business situations against strategic frameworks to provide decision-grade clarity.,https://taaft.co/sharix-r,,,,,,,,,,,,,,,,,,,,
02/04/2026,AirMusic,Image/Video,1,"Generates original songs, AI covers, and music videos from text prompts with royalty-free commercial licensing and vocal cloning.",https://taaft.co/airmusicvid-r,,,,,,,,,,,,,,,,,,,,
02/04/2026,Octopoda,Coding,1,"Provides persistent memory infrastructure for AI agents with semantic search, audit trails, and crash recovery.",https://taaft.co/octopoda-r,,,,,,,,,,,,,,,,,,,,
02/04/2026,Blotato,Image/Video,1,"Remixes videos, articles, and PDFs into social posts, schedules them, and generates faceless AI videos from a single dashboard.",https://taaft.co/blotato-r,,,,,,,,,,,,,,,,,,,,
02/04/2026,Apex,Productivity,1,"An AI digital twin that handles emails, Slack, calendar, app development, calls, and KPI monitoring.",https://taaft.co/apex-r,,,,,,,,,,,,,,,,,,,,
02/04/2026,MurmurCast,Productivity,1,"Transcribes and summarizes YouTube channels, podcasts, and newsletters into a personalized daily email digest.",https://taaft.co/murmurcast-r,,,,,,,,,,,,,,,,,,,,
02/04/2026,Pluspoint,Productivity,1,"Helps multi-location businesses manage reviews, listings, and customer messaging across directories with AI replies.",https://taaft.co/pluspoint-r,,,,,,,,,,,,,,,,,,,,
02/04/2026,Microsoft’s Free AI Agents Course,Coding,1,"A free, open-source 12-lesson curriculum for building AI agents with code samples, agentic patterns, and multi-agent orchestration.",https://github.com/microsoft/ai-agents-for-beginners,,,,,,,,,,,,,,,,,,,,
02/04/2026,SureThing.io,Productivity,1,"An autonomous AI agent that learns user goals, voice, and workflows to act across over 1,000 connected applications.",https://taaft.co/surething-s/?utm_source=taaft,,,,,,,,,,,,,,,,,,,,
02/04/2026,Ultravox,Other,1,Provides speech-native voice AI APIs for building real-time conversational agents with human-like responsiveness.,https://taaft.co/ultravoxai-r,,,,,,,,,,,,,,,,,,,,
02/04/2026,TaxHacker,Productivity,1,"Scans receipts and invoices, extracts structured data with customizable LLM prompts, and exports tax-ready reports.",https://github.com/vas3k/TaxHacker,,,,,,,,,,,,,,,,,,,,
02/04/2026,VibeVoice by Microsoft,Other,1,A voice AI framework from Microsoft offering Text-to-Speech capabilities with multiple speakers and a real-time streaming model.,https://github.com/microsoft/VibeVoice,,,,,,,,,,,,,,,,,,,,
02/04/2026,Paragon,Coding,1,"Provides guidance and tools for building production-ready, integration-enabled RAG and AI agents, including ingesting third-party data and enforcing access controls.",,,,,,,,,,,,,,,,,,,,,
02/04/2026,Neo4j,Coding,1,"Hosts NODES AI, an event to learn how to build smarter multi-agent systems with improved context layers.",,,,,,,,,,,,,,,,,,,,,
02/04/2026,AutoClaw,Productivity,1,A local AI assistant that breaks down and executes tasks.,,,,,,,,,,,,,,,,,,,,,
02/04/2026,Meta-Harness,Coding,1,A system that uses coding agents with full history access to optimize LLM harnesses end-to-end.,,,,,,,,,,,,,,,,,,,,,
02/04/2026,Google Agent Development Kit,Coding,1,"Google's Agent Development Kit, now with Java support and new features.",,,,,,,,,,,,,,,,,,,,,
02/04/2026,ChatGPT and Claude Projects,Productivity,1,"A guide for setting up AI projects using ChatGPT and Claude, focusing on consistent quality and scalability.",https://offers.hubspot.com/how-to-build-ai-projects?utm_medium=email-media-newsletter&utm_source=mindstream&utm_campaign=owned&utm_term=2026-03-31&utm_content=native-ads,,,,,,,,,,,,,,,,,,,,
02/04/2026,Opus 4.6,Other,1,An Anthropic LLM model showing notable self-recognition capabilities.,,,,,,,,,,,,,,,,,,,,,
02/04/2026,n8n,Productivity,1,An automation tool compatible with Attio CRM.,,,,,,,,,,,,,,,,,,,,,
02/04/2026,Litter,Productivity,1,Brings Codex functionality to your phone.,https://substack.com/redirect/b97ddf15-bced-43ff-afd0-555118389b97?j=eyJ1IjoiN3hvNTZiIn0.YBzePDZcx7ReocSEl7uMk3B2be1RYJqiTBygCGjCYtU,,,,,,,,,,,,,,,,,,,,
02/04/2026,Google’s AI Search,Research,1,"An AI search tool that can be used for personal favors, yielding surprising results.",,,,,,,,,,,,,,,,,,,,,
02/04/2026,Adobe Turntable,Image/Video,1,"A feature in Adobe Illustrator that generates multi-angle 3D views from 2D vector illustrations, dramatically reducing work time.",https://9to5mac.com/2026/03/30/adobe-illustrator-now-lets-you-rotate-2d-vectors-in-3d-space/?utm_source=tldrdesign,,,,,,,,,,,,,,,,,,,,
02/04/2026,"Pinterest's ""Promote a Pin""",Productivity,1,A new feature on Pinterest that allows users to boost their pin's reach using Pinterest's Taste Graph system.,https://techcrunch.com/2026/03/24/pinterest-launches-a-new-feature-to-promote-a-pin/?utm_source=tldrdesign,,,,,,,,,,,,,,,,,,,,
02/04/2026,Playcode AI website builder,Coding,1,"An AI website builder that creates, hosts, and updates business websites without requiring programming skills.",https://playcode.io/ai-website-builder?utm_source=tldrdesign,,,,,,,,,,,,,,,,,,,,
02/04/2026,Slicer.dev,Coding,1,A browser extension that converts website elements into AI-ready prompts for coding tools.,https://slicer.dev/?utm_source=tldrdesign,,,,,,,,,,,,,,,,,,,,
02/04/2026,Progress Agentic RAG,Research,1,A tool for getting insights from unstructured data at a lower cost than building RAG technology in-house.,https://www.progress.com/agentic-rag?utm_source=tldr&utm_medium=newsletter&utm_campaign=arag_q2_2026&utm_content=dev_primary_overview,,,,,,,,,,,,,,,,,,,,
02/04/2026,Semiotic,Coding,1,"A React data visualization library designed for AI-assisted development, offering various chart types and diagnostic tools.",https://github.com/nteract/semiotic?utm_source=tldrdev,,,,,,,,,,,,,,,,,,,,
02/04/2026,Kestra,Other,1,"An open-source, event-driven orchestrator for infrastructure, data, APIs, and AI workflows, allowing definition as code and real-time triggering.",https://fandf.co/4d7JdY7?utm_source=tldrnewsletter,,,,,,,,,,,,,,,,,,,,
02/04/2026,Azure Copilot Migration Agent,Productivity,1,A tool that provides strategies for making smarter application migration and modernization decisions.,https://fandf.co/4bW0xgr?utm_source=tldrnewsletter,,,,,,,,,,,,,,,,,,,,
